SocietyName,BHK,Furnishing,BuiltUpArea,Locality,NearbyPlace_1,DistanceAway_1,NearbyPlace_2,DistanceAway_2,Description,Highlights
Godrej Eden G And H,"2 BHK Flat for rent in Chandkheda, Ahmedabad",Fully Furnished,1350 sq.ft,"2 BHK Flat for rent in Chandkheda, Ahmedabad",Global Indian International School In Ahmedabad - Best International CBSE School,is 0.4 km away,Jenshiv Hospital - Physician - Diabetologist in Gota,is 2.3 km away,Your search for a spacious home at affordable rent in Ahmedabad ends here. The 2 BHK property offers a serene environment with excellent views of the city. This Apartment is equipped with the latest lifestyle amenities and all the conveniences at the doorstep. It is Fully Furnished Apartment. This unit is built on floor 12 out of a total 14 floors. The Apartment has been thoughtfully designed to meet a fami...,
Goyal Sky City,"4 BHK Villa for rent in Shela, Ahmedabad",Fully Furnished,3276 sq.ft,"4 BHK Villa for rent in Shela, Ahmedabad",Shanti Asiatic School,is 1.6 km away,Aalpa's children's hospital,is 2.4 km away,"Sky City Floris Villa, Shela, Ahmedabad - Residential Overview:

Sky City Floris Villa is a premium residential project located in Shela, Ahmedabad, known for its luxurious and modern living spaces. Set within the larger Sky City township, this exclusive villa development offers an ideal blend of serenity, style, and convenience, making it one of the most sought-after addresses in the city.

Key Highlights:...",
Orchid Blues,"2 BHK Flat for rent in Shela, Ahmedabad",Fully Furnished,1169 sq.ft,"2 BHK Flat for rent in Shela, Ahmedabad",Shanti Asiatic School,is 1.6 km away,Suryam Children Hospital South Bopal,is 2.5 km away,"Orchid Blues by Shela Ahmedabad is a premium residential project that combines contemporary living with serene surroundings. Located in the upscale neighborhood of Shela, this development offers a range of thoughtfully designed 2 and 3 BHK apartments, blending modern architecture with practical layouts. The project boasts luxurious amenities such as landscaped gardens, a state-of-the-art clubhouse, swimming...",
GSG Abode Orchid Sky,"3 BHK Flat for rent in Shela, Ahmedabad",Fully Furnished,1450 sq.ft,"3 BHK Flat for rent in Shela, Ahmedabad",Shanti Asiatic School,is 0.1 km away,Suryam Children Hospital South Bopal,is 1.1 km away,"This is 3 bhk flat available  with fully furnished  attached with electrical  items, luxurious  furniture  available,  available  on 1 of aug, gated society  and newly  construction society  have all the morden amenities, please do visit once if match the property  and call us for more details. More About This Property A spacious home designed for families aspiring for a modern lifestyle, this Apartment is ...",
Applewoods Sorrel,"2 BHK Flat for rent in Shela, Ahmedabad",Fully Furnished,1285 sq.ft,"2 BHK Flat for rent in Shela, Ahmedabad",Lakshaya International School,is 3.5 km away,Suryam Children Hospital South Bopal,is 2.7 km away,"3 Side Open Homes is available.
10.4K sq.m of Central Open Space
Kalorex Pre School Applewoods, 300 m away is an important landmark.
Properties with 100% power backup available
1.3 km from Pratibha Children's Clinic.

Sorrel is a house of luxury wrapped in the cushion of comfort. The apartments are designed for wholesome living and match the global standards of construction. With the best for your family
pl...",
,"5 BHK Villa for rent in South Bopal, Ahmedabad",Fully Furnished,2970 sq.ft,"5 BHK Villa for rent in South Bopal, Ahmedabad",GYANJYOT PUBLIC SCHOOL,is 0.1 km away,"Childhood hospital - Best Child specialist in Bopal, Pediatrician. Children Hospital in Bopal, NICU and PICU in Bopal",is 0.1 km away,"Welcome to Aman Bungalows, an exclusive residential enclave nestled in the tranquil and fast-growing suburb of Bopal, Ahmedabad. Designed to offer an oasis of luxury and comfort, each bungalow at Aman Bungalows embodies contemporary architecture, premium finishes, and spacious living.

Key Features:
Premium Bungalows: Thoughtfully designed, spacious 3 & 4 BHK bungalows with modern layouts, large living spac...",
Siddhi Aarohi Elysium,"3 BHK Flat for rent in South Bopal, Ahmedabad",Semi Furnished,1435 sq.ft,"3 BHK Flat for rent in South Bopal, Ahmedabad",LDR International School - South Bopal Branch,is 0.1 km away,Aalpa's children's hospital,is 0.8 km away,"Aarohi Elysium, located in South Bopal, Ahmedabad, is a premium residential development known for its blend of luxury, comfort, and modern amenities, making it an ideal choice for contemporary living. Designed with families and individuals in mind, it offers a range of spacious, well-ventilated apartments that feature modern interiors and high-quality finishes.

The project boasts a serene environment with ...",
Orchid Divine,"3 BHK Flat for rent in South Bopal, Ahmedabad",Fully Furnished,1435 sq.ft,"3 BHK Flat for rent in South Bopal, Ahmedabad",UTKARSH HIGH SCHOOL,is 0.1 km away,Elite Orthopedic and Women's Hospital,is 0.5 km away,"Check out this Apartment available for rent in South Bopal in Ahmedabad. It is a 3 BHK unit that comes at an affordable rent, with modern features and premium amenities to suit your lifestyle needs. The unit is Fully Furnished. It is an East facing property that has been constructed as per Vastu principles. With numerous new-age amenities and green surroundings, this Apartment provides a convenient lifestyl...",
,"5 BHK Flat for rent in Iscon Ambli Road, Ahmedabad",Fully Furnished,8500 sq.ft,"5 BHK Flat for rent in Iscon Ambli Road, Ahmedabad",Anand Niketan Group of Schools,is 0.1 km away,Epic Hospital,is 1.5 km away,"LUXURIOUS 5BHK PENTHOUSE WITH FULL MODERN AMENITIES & PRIME LOCATION
This is a modern and stylish home available for affordable rent in Ahmedabad. It is a 5 BHK With servant room situated at ISCON AMBLI ROAD. Designed to meet your lifestyle needs, the Flat provides a range of modern amenities for the comfort of the residents. It is Fully Furnished. Modern home seekers will experience a comfortable living in...",
Shivalik Sharda Park View,"3 BHK Flat for rent in Shela, Ahmedabad",Semi Furnished,1503 sq.ft,"3 BHK Flat for rent in Shela, Ahmedabad",LDR International School - South Bopal Branch,is 1.3 km away,Aalpa's children's hospital,is 1.9 km away,"3 BHK FULL FURNISHED FLAT AVAILABLE ON RENT 
 NEW PROPERTY & NEW CONTRUCTION  More About This Property A spacious home designed for families aspiring for a modern lifestyle, this Apartment is available for affordable rent in Ahmedabad. It is a 3 BHK Apartment situated in Shela at a coveted location with well-developed infrastructure. This Apartment is a good example of a well-planned residential property wi...",
GSG Abode Orchid Sky,"3 BHK Flat for rent in Shela, Ahmedabad",Fully Furnished,1500 sq.ft,"3 BHK Flat for rent in Shela, Ahmedabad",Shanti Asiatic School,is 0.1 km away,Suryam Children Hospital South Bopal,is 1.1 km away,"3 bhk furnished flat available on rent 

good property & nice location  More About This Property Check out this Apartment available for rent in Shela in Ahmedabad. It is a 3 BHK unit that comes at an affordable rent, with modern features and premium amenities to suit your lifestyle needs. The unit is Fully Furnished. It is an East facing property that has been constructed as per Vastu principles. With numer...",
,"2 BHK Flat for rent in Gota, Ahmedabad",Fully Furnished,1400 sq.ft,"2 BHK Flat for rent in Gota, Ahmedabad",SMT K N Patel International School,is 0.1 km away,Mansi Women's Hospital - Best Gynec Hospital - Best Gynecologist in Gota,is 0.6 km away,"This is a modern and stylish home available for affordable rent in Ahmedabad. It is a 2 BHK Apartment situated at Gota. Designed to meet your lifestyle needs, the Apartment provides a range of modern amenities for the comfort of the residents. It is Fully Furnished. Modern home seekers will experience a comfortable living in this 2 BHK property. The Apartment is on 4 floor, and the total number of floors is...",
,"3 BHK Flat for rent in Shela, Ahmedabad",Fully Furnished,1510 sq.ft,"3 BHK Flat for rent in Shela, Ahmedabad",LDR International School - South Bopal Branch,is 0.1 km away,Aalpa's children's hospital,is 1 km away,"Check this beautiful 3 BHK Apartment available for rent in Ahmedabad. Nestled at a prime location in Shela, it is an ideal home for those looking for a modern lifestyle. The Apartment is fully furnished, available for affordable rent. This 3 BHK unit is inside a gated society equipped with various amenities and ample greenery. The Apartment is thoughtfully designed to ensure a comfortable living. It include...",
Olive Heights II,"3 BHK Flat for rent in Satellite, Ahmedabad",Fully Furnished,3000 sq.ft,"3 BHK Flat for rent in Satellite, Ahmedabad",H B Kapadia New High School,is 1.6 km away,Arham Surgical Hospital - Best Piles Surgeon | Circumcision | Appendix | Laser Piles Surgery | Piles Doctor in Ahmedabad,is 0.7 km away,"Olive Heights is an unmatched Residential property located in Jodhpur, Ahmedabad. The project offers plenty of benefits that includes prime location, comfortable and lavish lifestyle, great amenities, healthy surroundings and high return.

Location Advantages:. Olive Heights is strategically located and provides direct connectivity to nearly all other major points in and around Ahmedabad. It is one of the m...",
Shivalik Sharda Park View,"3 BHK Flat for rent in Shela, Ahmedabad",Semi Furnished,1506 sq.ft,"3 BHK Flat for rent in Shela, Ahmedabad",LDR International School - South Bopal Branch,is 1.3 km away,Aalpa's children's hospital,is 1.9 km away,"3 bhk semi furnished flat available on rent 

4 working girls allowed & family allowed 
 More About This Property If you are looking for a modern house on rent in Ahmedabad, this Apartment in Shela can be your perfect home. It is a 3 BHK Apartment designed to meet your space and lifestyle needs. The 3 BHK unit is Semi Furnished. This rented 3 BHK property is spacious and well-designed, with access to all th...",
Shivam Shreenand Atria,"3 BHK Flat for rent in Sanand, Ahmedabad",Unfurnished,1700 sq.ft,"3 BHK Flat for rent in Sanand, Ahmedabad",Vikas Vidhyalay,is 2 km away,Nayan Children Hospital,is 0.8 km away,"Shree nand atria is wonderful society in Sanand .  3&2 BHK is luxurious flats, club house, children play area , terrorest garden , camuniti Holl , 24 hours security & CCTV camera , allotment parking . More About This Property Check this beautiful 3 BHK Apartment available for rent in Ahmedabad. Nestled at a prime location in Sanand, it is an ideal home for those looking for a modern lifestyle. The Apartment...",
Sankalp Grace II,"3 BHK Flat for rent in Ambli, Ahmedabad",Fully Furnished,3550 sq.ft,"3 BHK Flat for rent in Ambli, Ahmedabad",UTKARSH HIGH SCHOOL,is 1.1 km away,KIMS HOSPITAL,is 1.5 km away,"A spacious home designed for families aspiring for a modern lifestyle, this Apartment is available for affordable rent in Ahmedabad. It is a 3 BHK Apartment situated in Ambli at a coveted location with well-developed infrastructure. This Apartment is a good example of a well-planned residential property with all new-age conveniences available for the residents. The unit is fully furnished. The 3 BHK propert...",
Riviera Elite,"4 BHK Flat for rent in Shela, Ahmedabad",Fully Furnished,4450 sq.ft,"4 BHK Flat for rent in Shela, Ahmedabad",Shanti Asiatic School,is 0.1 km away,Suryam Children Hospital South Bopal,is 0.1 km away,4 BHK FULLY FURNISHED ULTRA LUXURIOUS FLAT AVAILABLE ON RENT CALL FOR MORE DETAILS.This Flat can be a comfortable and affordable home for your family. It is a 4 BHK unit available on rent at South Bopal in Ahmedabad. This Flat comes with a plethora of amenities to meet your modern lifestyle needs. It is fully furnished. It is located on floor 10 of the building having a total 20 floors. Offering beautiful c...,
,"3 BHK Flat for rent in Ramdev Nagar, Ahmedabad",Fully Furnished,3150 sq.ft,"3 BHK Flat for rent in Ramdev Nagar, Ahmedabad",The R.H. Kapadia New High School,is 0.6 km away,Shalby Multi-Specialty Hospitals,is 1.3 km away,"A quiet and beautiful Apartment located in the heart of the city is available for rent in Ahmedabad. The property is nicely located with all facilities nearby such as a market, hospital, mother dairy, shopping mall, bus stand, etc. The sector is very posh and premium. More About This Property This Apartment can be a comfortable and affordable home for your family. It is a 3 BHK unit available on rent at Jod...",
Shivalik Sharda Park View,"3 BHK Flat for rent in Shela, Ahmedabad",Fully Furnished,1500 sq.ft,"3 BHK Flat for rent in Shela, Ahmedabad",LDR International School - South Bopal Branch,is 1.3 km away,Aalpa's children's hospital,is 1.9 km away,"Experience the epitome of luxury living with this beautifully furnished 3 BHK apartment located in the upscale neighborhood of Shela. This residence is thoughtfully designed with top-notch furnishings and modern amenities, ensuring a comfortable and stylish lifestyle.Key Features:Spacious Layout: Generous living space with 3 well-appointed bedrooms, each designed for ultimate comfort.Elegant Interiors: Tast...",
Orchid Harmony,"3 BHK Flat for rent in Shela, Ahmedabad",Fully Furnished,2110 sq.ft,"3 BHK Flat for rent in Shela, Ahmedabad",Lakshaya International School,is 3.6 km away,Suryam Children Hospital South Bopal,is 2.7 km away,"Discover the epitome of luxury living with this exquisite 3 BHK fully furnished apartment in the prestigious Applewood community. Perfectly designed for those who appreciate elegance and comfort, this residence offers a sophisticated living experience.Key Features:Spacious Layout: This apartment boasts a generous layout with three well-appointed bedrooms, providing ample space for relaxation and privacy.Ele...",
Shivalik Edge,"4 BHK Flat for rent in Ambli, Ahmedabad",Fully Furnished,4450 sq.ft,"4 BHK Flat for rent in Ambli, Ahmedabad",UTKARSH HIGH SCHOOL,is 1.2 km away,Saraswati Multispeciality Hospital,is 3 km away,"This is a modern and stylish home available for affordable rent in Ahmedabad. It is a 4 BHK Flat situated at Ambli. Designed to meet your lifestyle needs, the Flat provides a range of modern amenities for the comfort of the residents. It is fully furnished. Modern home seekers will experience a comfortable living in this 4 BHK property. The Flat is on 1 floor, and the total number of floors is 14. The 4 BHK...",
Savvy Swaraaj Pragati Ph 2C,"3 BHK Flat for rent in Gota, Ahmedabad",Unfurnished,1730 sq.ft,"3 BHK Flat for rent in Gota, Ahmedabad",SMT K N Patel International School,is 2.3 km away,Excel Orthopedic and Kidney Care Hospital,is 0.3 km away,"3bhk kitchen furnished Residencial apartment on rent for family in savvy swaaraj phase 2 Pragati with all amenities. More About This Property Check out this Apartment available for rent in Chandlodia in Ahmedabad. It is a 3 BHK unit that comes at an affordable rent, with modern features and premium amenities to suit your lifestyle needs. The unit is unfurnished. It is an South-West facing property that has ...",
Mahadev Elegance,"3 BHK Flat for rent in Shela, Ahmedabad",Semi Furnished,1450 sq.ft,"3 BHK Flat for rent in Shela, Ahmedabad",LDR International School - South Bopal Branch,is 0.1 km away,Aalpa's children's hospital,is 1 km away,"This Apartment can be a comfortable and affordable home for your family. It is a 3 BHK unit available on rent at Shela in Ahmedabad. This Apartment comes with a plethora of amenities to meet your modern lifestyle needs. It is semi furnished. It is located on floor 11 of the building having a total 14 floors. Offering beautiful city views, this 3 BHK has been thoughtfully developed. It includes a total of 3 ...",
Sun Sky Park,"4 BHK Flat for rent in Ambli, Ahmedabad",Fully Furnished,3210 sq.ft,"4 BHK Flat for rent in Ambli, Ahmedabad",Ravi High School (Ravi Madhyamik Shala) & bhavna b.ed collage,is 1.2 km away,KIMS HOSPITAL,is 0.5 km away,"Experience the epitome of luxury living in this spacious 4 BHK flat located in the prestigious Sun Sky Park. This meticulously designed residence offers a perfect blend of elegance and comfort, featuring luxurious furniture and a generous layout.Key Features:4 Bedrooms, 4 Bathrooms: Each bedroom is designed to provide ample space and comfort, with attached bathrooms for added convenience.Spacious Living Are...",
Adani Water Lily,"4 BHK Flat for rent in Vaishno Devi Circle, Ahmedabad",Semi Furnished,3650 sq.ft,"4 BHK Flat for rent in Vaishno Devi Circle, Ahmedabad",Adani International School - Ahmedabad,is 1 km away,KD Hospital,is 4.9 km away,"4bhk semi furnished flat on rent in waterlily by adani shantigram, vaishnodevi circle, ahemdabad.. More About This Property This Apartment can be a comfortable and affordable home for your family. It is a 4 BHK unit available on rent at Shantigram in Ahmedabad. This Apartment comes with a plethora of amenities to meet your modern lifestyle needs. It is semi furnished. It is located on floor 7 of the buildin...",
,"3 BHK Flat for rent in Iscon Ambli Road, Ahmedabad",Fully Furnished,2100 sq.ft,"3 BHK Flat for rent in Iscon Ambli Road, Ahmedabad",Anand Niketan Group of Schools,is 0.1 km away,Epic Hospital,is 0.1 km away,"Check this beautiful 3 BHK Apartment available for rent in Ahmedabad. Nestled at a prime location in Ashok Vatika, it is an ideal home for those looking for a modern lifestyle. The Apartment is fully furnished, available for affordable rent. This 3 BHK unit is inside a gated society equipped with various amenities and ample greenery. The Apartment is thoughtfully designed to ensure a comfortable living. It ...",
Sharanya Skyvue,"3 BHK Flat for rent in Thaltej, Ahmedabad",Semi Furnished,3900 sq.ft,"3 BHK Flat for rent in Thaltej, Ahmedabad",Florescent school,is 1.5 km away,Zydus Hospitals,is 0.8 km away,"4bhk Semi Furnished flat on rent, With 4 Spacious bedrooms attached washrooms, With extra large dinning space, Very well maintained scheme in thaltej, Walking distance for daily needs, Local transportations, Very genuine and professional neighbourhood.Check this beautiful 4 BHK Flat available for rent in Ahmedabad. Nestled at a prime location in Thaltej, it is an ideal home for those looking for a modern li...",
Art Nirman Shree Vishnudhara Gardens ,"3 BHK Flat for rent in Gota, Ahmedabad",Unfurnished,1800 sq.ft,"3 BHK Flat for rent in Gota, Ahmedabad",SMT K N Patel International School,is 0.4 km away,Mansi Women's Hospital - Best Gynec Hospital - Best Gynecologist in Gota,is 0.3 km away,"Here is an excellent 3 BHK Apartment available for rent in Ahmedabad. Surrounded by natural greens and equipped with numerous amenities, this rented 3 BHK house offers a comfortable lifestyle for families. It is a spacious property nestled in Gota that enjoys good connectivity to major landmarks of the city. The Apartment is on the 1 floor. There is a total of 13 floors. The Apartment is designed as per mod...",
Parshwa RJ Pearl,"3 BHK Flat for rent in Chandkheda, Ahmedabad",Semi Furnished,1700 sq.ft,"3 BHK Flat for rent in Chandkheda, Ahmedabad",Apollo International School Tragad,is 0.1 km away,BHIMANI Children's Hospital & Vaccination Centre,is 3.2 km away,"This is a modern and stylish home available for affordable rent in Ahmedabad. It is a 3 BHK Apartment situated at Chandkheda. Designed to meet your lifestyle needs, the Apartment provides a range of modern amenities for the comfort of the residents. It is Semi Furnished. Modern home seekers will experience a comfortable living in this 3 BHK property. The Apartment is on 11 floor, and the total number of flo...",
,"2 BHK Flat for rent in Vaishno Devi Circle, Ahmedabad",Semi Furnished,1290 sq.ft,"2 BHK Flat for rent in Vaishno Devi Circle, Ahmedabad",Gems Genesis International School (GGIS),is 3.1 km away,Ashirvad Hospital - Best Gynecologist | Orthopaedic | Psychiatrist | Neurologist | Pediatrician Doctor Hospital,is 1.1 km away,"This is a modern and stylish home available for affordable rent in Ahmedabad. It is a 2 BHK Apartment situated at Khoraj. Designed to meet your lifestyle needs, the Apartment provides a range of modern amenities for the comfort of the residents. It is semi furnished. Modern home seekers will experience a comfortable living in this 2 BHK property. The Apartment is on 3 floor, and the total number of floors i...",
,"3 BHK Flat for rent in South Bopal, Ahmedabad",Semi Furnished,1615 sq.ft,"3 BHK Flat for rent in South Bopal, Ahmedabad",GYANJYOT PUBLIC SCHOOL,is 0.1 km away,Veeha Children's Hospital,is 0.9 km away,"If you are looking for a modern house on rent in Ahmedabad, this Apartment in South Bopal can be your perfect home. It is a 3 BHK Apartment designed to meet your space and lifestyle needs. The 3 BHK unit is semi furnished. This rented 3 BHK property is spacious and well-designed, with access to all the conveniences for any modern home seeker. It is located on floor 9 out of a total 14 floors . The Apartment...",
Swati Chrysantha,"3 BHK Flat for rent in Shela, Ahmedabad",Fully Furnished,1440 sq.ft,"3 BHK Flat for rent in Shela, Ahmedabad",LDR International School - South Bopal Branch,is 1.1 km away,Aalpa's children's hospital,is 1.9 km away,"If you are looking for a modern house on rent in Ahmedabad, this Apartment in Shela can be your perfect home. It is a 3 BHK Apartment designed to meet your space and lifestyle needs. The 3 BHK unit is fully furnished. This rented 3 BHK property is spacious and well-designed, with access to all the conveniences for any modern home seeker. It is located on floor 6 out of a total 12 floors . The Apartment has ...",
Shivalik Avenue,"4 BHK Flat for rent in Bodakdev, Ahmedabad",Fully Furnished,3300 sq.ft,"4 BHK Flat for rent in Bodakdev, Ahmedabad",Nirma Vidyavihar,is 0.2 km away,Gautam Medicare Polyclinic Bodakdev,is 0.3 km away,This is a well-designed 4 BHK Flat available for rent. It is situated in a prime location of Ahmedabad at Bodakdev. This modern Flat is semi furnished. The 4 BHK unit fulfills all the needs of a modern lifestyle for families. There is a total of 7 floors. This unit is on 4 floor. The Flat provides complete comfort for the residents. The Flat lets you enjoy the lush greenery around. Meticulously designed to ...,
Zaveri Amara,"3 BHK Flat for rent in Bodakdev, Ahmedabad",Fully Furnished,3225 sq.ft,"3 BHK Flat for rent in Bodakdev, Ahmedabad",Prakash School,is 1.3 km away,Gautam Medicare Polyclinic Bodakdev,is 0.1 km away,"A spacious home designed for families aspiring for a modern lifestyle, this Flat is available for affordable rent in Ahmedabad. It is a 5 BHK with servant room Flat situated in Bodakdev at a coveted location with well-developed infrastructure. This Flat is a good example of a well-planned residential property with all new-age conveniences available for the residents. The unit is Semi Furnished. The 5 BHK pr...",
,"2 BHK Flat for rent in Jagatpur, Ahmedabad",Fully Furnished,1170 sq.ft,"2 BHK Flat for rent in Jagatpur, Ahmedabad",Global Indian International School In Ahmedabad - Best International CBSE School,is 1.1 km away,Jenshiv Hospital - Physician - Diabetologist in Gota,is 0.9 km away,"This is a modern and stylish home available for affordable rent in Ahmedabad. It is a 2 BHK Apartment situated at Gota. Designed to meet your lifestyle needs, the Apartment provides a range of modern amenities for the comfort of the residents. It is fully furnished. Modern home seekers will experience a comfortable living in this 2 BHK property. The Apartment is on 8 floor, and the total number of floors is...",
,"3 BHK Villa for rent in Bhadaj, Ahmedabad",Unfurnished,2444 sq.ft,"3 BHK Villa for rent in Bhadaj, Ahmedabad",S S Divine School,is 4.9 km away,Vasundhara Children Hospital . Breastfeeding Clinic( Lactation Consultation)). Vaccination,is 6.5 km away,"WE HAVE AN UNFURNISHED 3 BHK HOUSE FOR RENT IN WELL MAINTAINED GATED COMMUNITY AT BHADAJ, AHEMDABAD. JK REAL ESTATE 1990. More About This Property Here is an excellent 3 BHK Villa available for rent in Ahmedabad. Surrounded by natural greens and equipped with numerous amenities, this rented 3 BHK house offers a comfortable lifestyle for families. It is a spacious property nestled in Santej that enjoys good ...",
Applewoods Sorrel,"3 BHK Flat for rent in Shela, Ahmedabad",Fully Furnished,1500 sq.ft,"3 BHK Flat for rent in Shela, Ahmedabad",Lakshaya International School,is 3.5 km away,Suryam Children Hospital South Bopal,is 2.7 km away,"Welcome to this exquisite, fully furnished flat in Applewood. This luxurious residence boasts a carefully curated selection of high-end furniture, creating a sophisticated and inviting atmosphere. From plush sofas to elegant dining sets, every piece has been chosen to provide both style and comfort. With spacious bedrooms, a modern kitchen, and beautifully appointed living areas, this flat offers a lifestyl...",
Orchid Heaven,"3 BHK Flat for rent in Shela, Ahmedabad",Fully Furnished,2040 sq.ft,"3 BHK Flat for rent in Shela, Ahmedabad",Lakshaya International School,is 3.3 km away,Suryam Children Hospital South Bopal,is 2.7 km away,"Welcome to this exquisite, fully furnished flat in Applewood. This luxurious residence boasts a carefully curated selection of high-end furniture, creating a sophisticated and inviting atmosphere. From plush sofas to elegant dining sets, every piece has been chosen to provide both style and comfort. With spacious bedrooms, a modern kitchen, and beautifully appointed living areas, this flat offers a lifestyl...",
