SocietyName,BHK,Furnishing,BuiltUpArea,Locality,NearbyPlace_1,DistanceAway_1,NearbyPlace_2,DistanceAway_2,Description,Highlights
Shaligram Garden Residency I,"3 BHK Flat for rent in South Bopal, Ahmedabad",Unfurnished,1730 sq.ft,"3 BHK Flat for rent in South Bopal, Ahmedabad",GYANJYOT PUBLIC SCHOOL,is 0.1 km away,Shreeji Hospital - Best Physician in South Bopal,is 1.4 km away,"2bhk Most Iconic Society Flat for Rent at South bopal More About This Property Check out this Apartment available for rent in South Bopal in Ahmedabad. It is a 3 BHK unit that comes at an affordable rent, with modern features and premium amenities to suit your lifestyle needs. The unit is Unfurnished. It is an East facing property that has been constructed as per Vastu principles. With numerous new-age amen...",
,"2 BHK Flat for rent in South Bopal, Ahmedabad",Fully Furnished,1120 sq.ft,"2 BHK Flat for rent in South Bopal, Ahmedabad",GYANJYOT PUBLIC SCHOOL,is 0.1 km away,Veeha Children's Hospital,is 0.9 km away,2bhk furnished Flat at Most prime location of South bopal More About This Property This is a well-designed 2 BHK Apartment available for rent. It is situated in a prime location of Ahmedabad at South Bopal. This modern Apartment is fully furnished. The 2 BHK unit fulfills all the needs of a modern lifestyle for families. There is a total of 5 floors. This unit is on 1 floor. The Apartment provides complete ...,
Anand Skylyf,"2 BHK Flat for rent in Chandkheda, Ahmedabad",Semi Furnished,1050 sq.ft,"2 BHK Flat for rent in Chandkheda, Ahmedabad",Apollo International School Tragad,is 1.3 km away,Jenshiv Hospital - Physician - Diabetologist in Gota,is 5.4 km away,"Your search for a spacious home at affordable rent in Ahmedabad ends here. This 2 BHK Apartment in Chandkheda is all that you have been looking for! Designed as East facing, the unit is compliant with Vastu principles. The 2 BHK property offers a serene environment with excellent views of the city. This Apartment is equipped with the latest lifestyle amenities and all the conveniences at the doorstep. It is...",
Binori Solitaire,"3 BHK Flat for rent in South Bopal, Ahmedabad",Fully Furnished,2214 sq.ft,"3 BHK Flat for rent in South Bopal, Ahmedabad",UTKARSH HIGH SCHOOL,is 0.1 km away,Elite Orthopedic and Women's Hospital,is 0.6 km away,"3 BHK Fully Furnished Penthouse for Rent in Prime Location, South Bopal

Are you looking for a luxurious living space in South Bopal? A stunning 3 BHK penthouse is available for rent, perfect for a family seeking comfort and convenience.

Key Features:

Location: Situated in a prime area of South Bopal with easy access to schools, shopping centers, and parks.
Size: Spacious 3 BHK layout, ideal for a family....",
HN Safal Marigold,"2 BHK Flat for rent in South Bopal, Ahmedabad",Semi Furnished,1250 sq.ft,"2 BHK Flat for rent in South Bopal, Ahmedabad",GYANJYOT PUBLIC SCHOOL,is 0.1 km away,Veeha Children's Hospital,is 1.3 km away,"It is semi furnished flat available on rent. Flat is located in one of the prime area of the south bopal . Apartment has all the amenities like GY M , Swimming Pool an many more . More About This Property Check out this Apartment available for rent in South Bopal in Ahmedabad. It is a 2 BHK unit that comes at an affordable rent, with modern features and premium amenities to suit your lifestyle needs. The un...",
Godrej Green Glades,"3 BHK Flat for rent in Jagatpur, Ahmedabad",Semi Furnished,1450 sq.ft,"3 BHK Flat for rent in Jagatpur, Ahmedabad",Global Indian International School In Ahmedabad - Best International CBSE School,is 1.2 km away,Jenshiv Hospital - Physician - Diabetologist in Gota,is 1.3 km away,This is a well-designed 3 BHK Apartment available for rent. It is situated in a prime location of Ahmedabad at Gota. This modern Apartment is semi furnished. The 3 BHK unit fulfills all the needs of a modern lifestyle for families. There is a total of 14 floors. This unit is on 6 floor. The Apartment provides complete comfort for the residents. The Apartment lets you enjoy the lush greenery around. Meticulo...,
Bakeri Sakshat Apartments,"2 BHK Flat for rent in Vejalpur, Ahmedabad",Semi Furnished,1500 sq.ft,"2 BHK Flat for rent in Vejalpur, Ahmedabad",Ananda Global School - Best CBSE School in Ahmedabad,is 0.1 km away,Amena Khatun Multi Speciality Hospital Ahmedabad,is 1 km away,"2 BHK SEMI FURNISHED FLAT 
GOOD LOCATION AND CONDITION 
WELL MAINTAIN SOCIETY 
24 HOUR WATER LIFT ALLOTED PARKING  More About This Property Are you looking for an affordable Apartment for rent in Ahmedabad?. Here is a spacious 2 BHK Apartment in Juhapura, promising a comfortable lifestyle. The Apartment is semi furnished. Built on floor 2 out of a total 5 floors, it is an ideal home providing beautiful view...",
Motherland Magnate Lifestyle,"3 BHK Flat for rent in Vaishno Devi Circle, Ahmedabad",Semi Furnished,1675 sq.ft,"3 BHK Flat for rent in Vaishno Devi Circle, Ahmedabad",Gems Genesis International School (GGIS),is 1.2 km away,KD Hospital,is 1.1 km away,"If you are looking for a modern house on rent in Ahmedabad, this Apartment in Khodiyar can be your perfect home. It is a 3 BHK Apartment designed to meet your space and lifestyle needs. The 3 BHK unit is semi furnished. This rented 3 BHK property is spacious and well-designed, with access to all the conveniences for any modern home seeker. It is located on floor 6 out of a total 12 floors . The Apartment ha...",
Dwarkesh Opulence,"3 BHK Flat for rent in Tragad, Ahmedabad",Unfurnished,2040 sq.ft,"3 BHK Flat for rent in Tragad, Ahmedabad",H3 World School,is 1 km away,Ashirvad Hospital - Best Gynecologist | Orthopaedic | Psychiatrist | Neurologist | Pediatrician Doctor Hospital,is 3.3 km away,"3bhk residential apartment for rent in Dwarkesh Opulence located in vaishnodevi area with all amenities More About This Property Check this beautiful 3 BHK Apartment available for rent in Ahmedabad. Nestled at a prime location in Tragad, it is an ideal home for those looking for a modern lifestyle. The Apartment is Unfurnished, available for affordable rent. This 3 BHK unit is inside a gated society equippe...",
,"4 BHK Independent House for rent in South Bopal, Ahmedabad",Semi Furnished,1500 sq.ft,"4 BHK Independent House for rent in South Bopal, Ahmedabad",The New Tulip International School,is 1 km away,Shivam Hospital Bopal,is 1.1 km away,"Check out this Independent House available for rent in South Bopal in Ahmedabad. It is a 4 BHK unit that comes at an affordable rent, with modern features and premium amenities to suit your lifestyle needs. The unit is semi furnished. With numerous new-age amenities and green surroundings, this Independent House provides a convenient lifestyle for residents. A spacious house for your family, this unit inclu...",
Pavanputra Pancham Pentagon,"2 BHK Flat for rent in Chandkheda, Ahmedabad",Semi Furnished,1230 sq.ft,"2 BHK Flat for rent in Chandkheda, Ahmedabad",Apollo International School Tragad,is 0.1 km away,Ashirvad Hospital - Best Gynecologist | Orthopaedic | Psychiatrist | Neurologist | Pediatrician Doctor Hospital,is 5.2 km away,"If you are looking for a modern house on rent in Ahmedabad, this Apartment in Chandkheda can be your perfect home. It is a 2 BHK Apartment designed to meet your space and lifestyle needs. The 2 BHK unit is semi furnished. This rented 2 BHK property is spacious and well-designed, with access to all the conveniences for any modern home seeker. It is located on floor 8 out of a total 9 floors . The Apartment h...",
,"2 BHK Flat for rent in Vastral, Ahmedabad",Semi Furnished,1250 sq.ft,"2 BHK Flat for rent in Vastral, Ahmedabad",United public School Ahmedabad,is 0.1 km away,Prabhu Women's Hospital | Best Gynecologist Hospital in vastral,is 0.4 km away,"A spacious home designed for families aspiring for a modern lifestyle, this Apartment is available for affordable rent in Ahmedabad. It is a 2 BHK Apartment situated in Vastral at a coveted location with well-developed infrastructure. This Apartment is a good example of a well-planned residential property with all new-age conveniences available for the residents. The unit is semi furnished. The 2 BHK proper...",
Swastik Greens,"2 BHK Flat for rent in Bopal, Ahmedabad",Semi Furnished,1250 sq.ft,"2 BHK Flat for rent in Bopal, Ahmedabad",LDR International School - South Bopal Branch,is 1.1 km away,Krishna Shalby Multi-Specialty Hospital,is 1.6 km away,"This is a modern and stylish home available for affordable rent in Ahmedabad. It is a 2 BHK Apartment situated at Bopal. Designed to meet your lifestyle needs, the Apartment provides a range of modern amenities for the comfort of the residents. It is Semi Furnished. Modern home seekers will experience a comfortable living in this 2 BHK property. The Apartment is on 8 floor, and the total number of floors is...",
Rajvi Aashirvad Heights,"2 BHK Flat for rent in Vasna, Ahmedabad",Unfurnished,1071 sq.ft,"2 BHK Flat for rent in Vasna, Ahmedabad",RC Patel High School,is 0.9 km away,Health and Care Foundation Charitable Hospital,is 1.3 km away,"This Apartment can be a comfortable and affordable home for your family. It is a 2 BHK unit available on rent at Vasna in Ahmedabad. This Apartment comes with a plethora of amenities to meet your modern lifestyle needs. It is unfurnished. It is located on floor 3 of the building having a total 10 floors. Offering beautiful city views, this 2 BHK has been thoughtfully developed. It includes a total of 2 bedr...",
,"2 BHK Flat for rent in Chandkheda, Ahmedabad",Fully Furnished,1150 sq.ft,"2 BHK Flat for rent in Chandkheda, Ahmedabad",Gyandeep Vidyalaya,is 1.7 km away,BHIMANI Children's Hospital & Vaccination Centre,is 2 km away,"Check this beautiful 2 BHK Apartment available for rent in Ahmedabad. Nestled at a prime location in Chandkheda, it is an ideal home for those looking for a modern lifestyle. The Apartment is fully furnished, available for affordable rent. This 2 BHK unit is inside a gated society equipped with various amenities and ample greenery. The Apartment is thoughtfully designed to ensure a comfortable living. It in...",
Shree Sarju Greens,"2 BHK Flat for rent in Chandkheda, Ahmedabad",Fully Furnished,1150 sq.ft,"2 BHK Flat for rent in Chandkheda, Ahmedabad",Gyandeep Vidyalaya,is 0.1 km away,BHIMANI Children's Hospital & Vaccination Centre,is 2.8 km away,"Are you looking for an affordable Apartment for rent in Ahmedabad?. Here is a spacious 2 BHK Apartment in Chandkheda, promising a comfortable lifestyle. The Apartment is fully furnished. Built on floor 8 out of a total 9 floors, it is an ideal home providing beautiful views of the city’s skyline. This property is designed to suit your space needs and has 2 bedrooms and 2 bathroom. It also includes 1 balcony...",
Sampad Residency,"2 BHK Flat for rent in Motera, Ahmedabad",Fully Furnished,1150 sq.ft,"2 BHK Flat for rent in Motera, Ahmedabad",Swastik Academy,is 0.7 km away,"SBM, SATYABHAMADEVI BULCHAND MEMORIAL HOSPITAL",is 0.8 km away,"This is a modern and stylish home available for affordable rent in Ahmedabad. It is a 2 BHK Apartment situated at Motera. Designed to meet your lifestyle needs, the Apartment provides a range of modern amenities for the comfort of the residents. It is fully furnished. Modern home seekers will experience a comfortable living in this 2 BHK property. The Apartment is on 1 floor, and the total number of floors ...",
Shyam Saral,"3 BHK Flat for rent in Tragad, Ahmedabad",Semi Furnished,1600 sq.ft,"3 BHK Flat for rent in Tragad, Ahmedabad",Apollo International School Tragad,is 0.3 km away,Jenshiv Hospital - Physician - Diabetologist in Gota,is 5.6 km away,"If you are looking for a modern house on rent in Ahmedabad, this Apartment in Tragad can be your perfect home. It is a 3 BHK Apartment designed to meet your space and lifestyle needs. The 3 BHK unit is semi furnished. This rented 3 BHK property is spacious and well-designed, with access to all the conveniences for any modern home seeker. It is located on floor 9 out of a total 12 floors . The Apartment has ...",
,"2 BHK Flat for rent in Chandkheda, Ahmedabad",Semi Furnished,1150 sq.ft,"2 BHK Flat for rent in Chandkheda, Ahmedabad",Gyandeep Vidyalaya,is 1.7 km away,BHIMANI Children's Hospital & Vaccination Centre,is 2 km away,"If you are looking for a modern house on rent in Ahmedabad, this Apartment in Chandkheda can be your perfect home. It is a 2 BHK Apartment designed to meet your space and lifestyle needs. The 2 BHK unit is semi furnished. This rented 2 BHK property is spacious and well-designed, with access to all the conveniences for any modern home seeker. It is located on floor 5 out of a total 10 floors . The Apartment ...",
Prathna Pearl,"2 BHK Flat for rent in Gota, Ahmedabad",Unfurnished,1080 sq.ft,"2 BHK Flat for rent in Gota, Ahmedabad",SMT K N Patel International School,is 0.5 km away,Mansi Women's Hospital - Best Gynec Hospital - Best Gynecologist in Gota,is 0.4 km away,2bhk kitchen furnished flat on rent for family in vandematram road gota with basic amenities. More About This Property This is a well-designed 2 BHK Apartment available for rent. It is situated in a prime location of Ahmedabad at Gota. This modern Apartment is unfurnished. The 2 BHK unit fulfills all the needs of a modern lifestyle for families. There is a total of 7 floors. This unit is on 3 floor. The Apa...,
Ratna Turquoise Greenz,"3 BHK Flat for rent in Shela, Ahmedabad",Semi Furnished,1750 sq.ft,"3 BHK Flat for rent in Shela, Ahmedabad",LDR International School - South Bopal Branch,is 0.6 km away,Krishna Shalby Multi-Specialty Hospital,is 2.4 km away,"3 BHK Brand New Scheme. Semi Furnished apartment available for rent in Turquoise Greenz. VIP Road Touch. Unused Apartment.  More About This Property Your search for a spacious home at affordable rent in Ahmedabad ends here. This 3 BHK Apartment in Shela is all that you have been looking for! Designed as East facing, the unit is compliant with Vastu principles. The 3 BHK property offers a serene environment ...",
Navratna Kalhaar Blues and Greens,"2 BHK Villa for rent in Sanand, Ahmedabad",Fully Furnished,3465 sq.ft,"2 BHK Villa for rent in Sanand, Ahmedabad",HELLO WORLD ENGLISH MEDIUM SCHOOL,is 1.7 km away,Nayan Children Hospital,is 4.2 km away,"Kalhaar Blues and Greens villa is a located at an excellent locality in Ahmedabad where you will enjoy everything nearby. The project is located in a peaceful place where you will enjoy a life that is away from a hasty tone and fuzziness of the city. With quality construction and all the high-end amenities, you can enjoy life in a beautiful villas that is perfectly designed with architectural designs.Kalhaa...",
Indraprasth Gulmohar,"4 BHK Flat for rent in Vastrapur, Ahmedabad",Semi Furnished,4400 sq.ft,"4 BHK Flat for rent in Vastrapur, Ahmedabad",Nirman High School,is 0.6 km away,Parth Hospital - Best Psychiatric Hospital in Ahmedabad,is 0.9 km away,"If you are looking for a modern house on rent in Ahmedabad, this Apartment in Vastrapur can be your perfect home. It is a 4 BHK Apartment designed to meet your space and lifestyle needs. The 4 BHK unit is semi furnished. This rented 4 BHK property is spacious and well-designed, with access to all the conveniences for any modern home seeker. It is located on floor 6 out of a total 14 floors . The Apartment h...",
Navratna Kalhaar Blues and Greens,"4 BHK Villa for rent in Sanand, Ahmedabad",Fully Furnished,4000 sq.ft,"4 BHK Villa for rent in Sanand, Ahmedabad",HELLO WORLD ENGLISH MEDIUM SCHOOL,is 1.7 km away,Nayan Children Hospital,is 4.2 km away,"For Rent - live with PrivacyWe have many more options for rent in all the area of ahmedabad. For more options, kindly contact us.Note : We are RERA Registered Broker. More About This Property Here is an excellent 4 BHK Villa available for rent in Ahmedabad. Surrounded by natural greens and equipped with numerous amenities, this rented 4 BHK house offers a comfortable lifestyle for families. It is a spacious...",
,"4 BHK Flat for rent in Vastrapur, Ahmedabad",Semi Furnished,4400 sq.ft,"4 BHK Flat for rent in Vastrapur, Ahmedabad",Nirman High School,is 0.6 km away,Parth Hospital - Best Psychiatric Hospital in Ahmedabad,is 0.9 km away,"Here is an excellent 4 BHK Apartment available for rent in Ahmedabad. Surrounded by natural greens and equipped with numerous amenities, this rented 4 BHK house offers a comfortable lifestyle for families. It is a spacious property nestled in Vastrapur that enjoys good connectivity to major landmarks of the city. The Apartment is on the 13 floor. There is a total of 14 floors. The Apartment is designed as p...",
Sai Green Valley 2,"2 BHK Flat for rent in Ghuma, Ahmedabad",Semi Furnished,1120 sq.ft,"2 BHK Flat for rent in Ghuma, Ahmedabad",Delhi Public School Bopal - Top CBSE School in Ahmedabad,is 1.2 km away,Aditi Hospital & Diagnostics,is 2.2 km away,"This Apartment can be a comfortable and affordable home for your family. It is a 2 BHK unit available on rent at Ghuma in Ahmedabad. This Apartment comes with a plethora of amenities to meet your modern lifestyle needs. It is semi furnished. It is located on floor 2 of the building having a total 7 floors. Offering beautiful city views, this 2 BHK has been thoughtfully developed. It includes a total of 2 be...",
"United Serene Elegancy, Bopal","3 BHK Flat for rent in South Bopal, Ahmedabad",Unfurnished,1750 sq.ft,"3 BHK Flat for rent in South Bopal, Ahmedabad",Shiv Ashish School,is 0.8 km away,Adwait Multispecialty Hospital,is 2.2 km away,"Check out this Apartment available for rent in South Bopal in Ahmedabad. It is a 3 BHK unit that comes at an affordable rent, with modern features and premium amenities to suit your lifestyle needs. The unit is unfurnished. It is an East facing property that has been constructed as per Vastu principles. With numerous new-age amenities and green surroundings, this Apartment provides a convenient lifestyle fo...",
Safal Parisar I,"2 BHK Flat for rent in Bopal, Ahmedabad",Fully Furnished,1540 sq.ft,"2 BHK Flat for rent in Bopal, Ahmedabad",The New Tulip International School,is 1.1 km away,Shivam Hospital Bopal,is 0.4 km away,"Check this beautiful 2 BHK Apartment available for rent in Ahmedabad. Nestled at a prime location in Bopal, it is an ideal home for those looking for a modern lifestyle. The Apartment is fully furnished, available for affordable rent. This 2 BHK unit is inside a gated society equipped with various amenities and ample greenery. The Apartment is thoughtfully designed to ensure a comfortable living. It include...",
,"3 BHK Flat for rent in Chandkheda, Ahmedabad",Semi Furnished,1250 sq.ft,"3 BHK Flat for rent in Chandkheda, Ahmedabad",Gyandeep Vidyalaya,is 1.7 km away,BHIMANI Children's Hospital & Vaccination Centre,is 2 km away,"Check this beautiful 3 BHK Apartment available for rent in Ahmedabad. Nestled at a prime location in Chandkheda, it is an ideal home for those looking for a modern lifestyle. The Apartment is semi furnished, available for affordable rent. This 3 BHK unit is inside a gated society equipped with various amenities and ample greenery. The Apartment is thoughtfully designed to ensure a comfortable living. It inc...",
,"2 BHK Flat for rent in Jagatpur, Ahmedabad",Semi Furnished,1100 sq.ft,"2 BHK Flat for rent in Jagatpur, Ahmedabad",Global Indian International School In Ahmedabad - Best International CBSE School,is 1.1 km away,Jenshiv Hospital - Physician - Diabetologist in Gota,is 0.9 km away,"2bhk residencial apartment semi furnished in ganesh parisar at jagatpur for family only.  More About This Property Are you looking for an affordable Apartment for rent in Ahmedabad?. Here is a spacious 2 BHK Apartment in Gota, promising a comfortable lifestyle. The Apartment is Semi Furnished. Built on floor 7 out of a total 7 floors, it is an ideal home providing beautiful views of the city’s skyline. This...",
Pacifica The Meadows,"4 BHK Villa for rent in Shantipura, Ahmedabad",Fully Furnished,3150 sq.ft,"4 BHK Villa for rent in Shantipura, Ahmedabad",Eklavya School,is 1.9 km away,Suryam Children Hospital South Bopal,is 5.3 km away,"Fully furnished 4bhk bungalow available on rent in the meadows,gokuldham. With plot 334 sqyd area and 350 sqyd construction area.Call for more details more options...

 More About This Property Your search for a spacious home at affordable rent in Ahmedabad ends here. This 4 BHK Villa in Shantipura is all that you have been looking for! Designed as North-East facing, the unit is compliant with Vastu princip...",
KGB KB Phoenix,"2 BHK Flat for rent in Chandkheda, Ahmedabad",Semi Furnished,1050 sq.ft,"2 BHK Flat for rent in Chandkheda, Ahmedabad",Apollo International School Tragad,is 0.1 km away,BHIMANI Children's Hospital & Vaccination Centre,is 3.5 km away,"If you are looking for a modern house on rent in Ahmedabad, this Apartment in Chandkheda can be your perfect home. It is a 2 BHK Apartment designed to meet your space and lifestyle needs. The 2 BHK unit is semi furnished. This rented 2 BHK property is spacious and well-designed, with access to all the conveniences for any modern home seeker. It is located on floor 10 out of a total 12 floors . The Apartment...",
Swetalee Sepal Elegant 2,"2 BHK Flat for rent in Chandkheda, Ahmedabad",Fully Furnished,1050 sq.ft,"2 BHK Flat for rent in Chandkheda, Ahmedabad",Apollo International School Tragad,is 1.3 km away,BHIMANI Children's Hospital & Vaccination Centre,is 4.1 km away,This is a well-designed 2 BHK Apartment available for rent. It is situated in a prime location of Ahmedabad at Chandkheda. This modern Apartment is fully furnished. The 2 BHK unit fulfills all the needs of a modern lifestyle for families. There is a total of 10 floors. This unit is on 7 floor. The Apartment provides complete comfort for the residents. The Apartment lets you enjoy the lush greenery around. M...,
Orchid Greenfield,"2 BHK Flat for rent in Shela, Ahmedabad",Fully Furnished,1650 sq.ft,"2 BHK Flat for rent in Shela, Ahmedabad",Lakshaya International School,is 3 km away,Suryam Children Hospital South Bopal,is 2.2 km away,2bhk fullfurnished Flat for Rent at Applewoods township shela More About This Property This is a well-designed 2 BHK Apartment available for rent. It is situated in a prime location of Ahmedabad at Shela. This modern Apartment is fully furnished. The 2 BHK unit fulfills all the needs of a modern lifestyle for families. There is a total of 16 floors. This unit is on 8 floor. The Apartment provides complete c...,
Vishwanath Sopan,"2 BHK Flat for rent in Shela, Ahmedabad",Semi Furnished,1314 sq.ft,"2 BHK Flat for rent in Shela, Ahmedabad",LDR International School - South Bopal Branch,is 0.9 km away,Aalpa's children's hospital,is 2.1 km away,"This Apartment can be a comfortable and affordable home for your family. It is a 2 BHK unit available on rent at Shela in Ahmedabad. This Apartment comes with a plethora of amenities to meet your modern lifestyle needs. It is semi furnished. It is located on floor 7 of the building having a total 7 floors. Offering beautiful city views, this 2 BHK has been thoughtfully developed. It includes a total of 2 be...",
Kaveri Soham Vivanta,"3 BHK Flat for rent in Shilaj, Ahmedabad",Semi Furnished,1555 sq.ft,"3 BHK Flat for rent in Shilaj, Ahmedabad",Anand Niketan Shilaj,is 2.8 km away,Atulit Children's Hospital,is 2.9 km away,"3BHk semi furnished with sofa fridge light fan modular kitchen More About This Property Are you looking for an affordable Apartment for rent in Ahmedabad?. Here is a spacious 3 BHK Apartment in Shilaj, promising a comfortable lifestyle. The Apartment is Semi Furnished. Built on floor 7 out of a total 14 floors, it is an ideal home providing beautiful views of the city’s skyline. This property is designed to...",
,"2 BHK Flat for rent in Ognaj, Ahmedabad",Semi Furnished,1000 sq.ft,"2 BHK Flat for rent in Ognaj, Ahmedabad",St. Mary's Higher Secondary School,is 0.8 km away,Divine Women's Hospital,is 3.6 km away,"2bhk semi furnished flat on rent in vir savarkar height at vasantnagar township at ognaj road gota  for family only. More About This Property Here is an excellent 2 BHK Apartment available for rent in Ahmedabad. Surrounded by natural greens and equipped with numerous amenities, this rented 2 BHK house offers a comfortable lifestyle for families. It is a spacious property nestled in Ognaj that enjoys good co...",
Shivalik Sharda Park View,"3 BHK Flat for rent in Shela, Ahmedabad",Semi Furnished,1435 sq.ft,"3 BHK Flat for rent in Shela, Ahmedabad",LDR International School - South Bopal Branch,is 1.3 km away,Aalpa's children's hospital,is 1.9 km away,"3 BHk Semi Furnished flat for rent in parkview for family  More About This Property If you are looking for a modern house on rent in Ahmedabad, this Apartment in Shela can be your perfect home. It is a 3 BHK Apartment designed to meet your space and lifestyle needs. The 3 BHK unit is semi furnished. This rented 3 BHK property is spacious and well-designed, with access to all the conveniences for any modern ...",
Ratna Turquoise Greenz,"3 BHK Flat for rent in Shela, Ahmedabad",Semi Furnished,1700 sq.ft,"3 BHK Flat for rent in Shela, Ahmedabad",LDR International School - South Bopal Branch,is 0.6 km away,Krishna Shalby Multi-Specialty Hospital,is 2.4 km away,"3BHK semi furnished flat for rent in shela with modular kitchen light fan curtain rode newly painted flat  More About This Property Check this beautiful 3 BHK Apartment available for rent in Ahmedabad. Nestled at a prime location in Shela, it is an ideal home for those looking for a modern lifestyle. The Apartment is semi furnished, available for affordable rent. This 3 BHK unit is inside a gated society eq...",
