SocietyName,BHK,Furnishing,BuiltUpArea,Locality,NearbyPlace_1,DistanceAway_1,NearbyPlace_2,DistanceAway_2,Description,Highlights
Ganesh Malabar Retreat,"2 BHK Flat for rent in Vaishno Devi Circle, Ahmedabad",Fully Furnished,1200 sq.ft,"2 BHK Flat for rent in Vaishno Devi Circle, Ahmedabad",Nirma Vidyavihar - Chharodi,is 0.5 km away,SGVP Holistic Hospital,is 2.2 km away,"Malabar retreat it's totally new apartment near vaishnodevi circle it's good apartment near by hospital near by bus stand near by school  More About This Property Here is an excellent 2 BHK Apartment available for rent in Ahmedabad. Surrounded by natural greens and equipped with numerous amenities, this rented 2 BHK house offers a comfortable lifestyle for families. It is a spacious property nestled in Khod...",Property HighlightsATMAnti Skid TitlesAmphitheatreAerobics Room
Vivaan Eminence,"3 BHK Flat for rent in Zundal, Ahmedabad",Semi Furnished,1750 sq.ft,"3 BHK Flat for rent in Zundal, Ahmedabad",Puna International School,is 0.1 km away,Ashirvad Hospital - Best Gynecologist | Orthopaedic | Psychiatrist | Neurologist | Pediatrician Doctor Hospital,is 0.1 km away,"This Apartment can be a comfortable and affordable home for your family. It is a 3 BHK unit available on rent at Zundal in Ahmedabad. This Apartment comes with a plethora of amenities to meet your modern lifestyle needs. It is Semi Furnished. It is located on floor 5 of the building having a total 14 floors. Offering beautiful city views, this 3 BHK has been thoughtfully developed. It includes a total of 3 ...",Property Highlights24x7 SecurityBusiness CenterChildren Play AreaClose to Bus Stop
Om Sky,"3 BHK Flat for rent in Science City, Ahmedabad",Fully Furnished,1815 sq.ft,"3 BHK Flat for rent in Science City, Ahmedabad",Taksh Education,is 0.9 km away,Balaji Horizon Women's Hospital,is 0.3 km away,"Luxurious Fully Furnished Flat for Rent in Science City  More About This Property Are you looking for an affordable Apartment for rent in Ahmedabad?. Here is a spacious 3 BHK Apartment in Sola Village, promising a comfortable lifestyle. The Apartment is fully furnished. Built on floor 7 out of a total 14 floors, it is an ideal home providing beautiful views of the city’s skyline. This property is designed t...",Property HighlightsGymnasiumChildren Play AreaIndoor Game RoomSwimming Pool
Orchid Legacy,"3 BHK Flat for rent in Shela, Ahmedabad",Semi Furnished,2013 sq.ft,"3 BHK Flat for rent in Shela, Ahmedabad",Lakshaya International School,is 4.1 km away,Suryam Children Hospital South Bopal,is 3.3 km away,A residential flat available for rent in the prime location of city 24 hour water Secuirty.facilities available. Very space ful locality. All basic needs available nearby. Vell devloped recidential. Villas  and apartment. Market splace. Business centre.school and bank a just walking distance. More About This Property Check this beautiful 3 BHK Apartment available for rent in Ahmedabad. Nestled at a prime lo...,Property Highlights24 Hours Concierge24x7 SecurityClose to HospitalClose to Mall
,"2 BHK Flat for rent in Shahibaug, Ahmedabad",Fully Furnished,1250 sq.ft,"2 BHK Flat for rent in Shahibaug, Ahmedabad",SHREE VIDHYA ARADHANA TIRTH (SVAT),is 0.1 km away,Aksharkrupa Hospital,is 0.1 km away,This is a well-designed 2 BHK Apartment available for rent. It is situated in a prime location of Ahmedabad at Shahibuag. This modern Apartment is fully furnished. The 2 BHK unit fulfills all the needs of a modern lifestyle for families. There is a total of 8 floors. This unit is on 5 floor. The Apartment provides complete comfort for the residents. The Apartment lets you enjoy the lush greenery around. Met...,
,"1 BHK Flat for rent in Jagatpur, Ahmedabad",Fully Furnished,635 sq.ft,"1 BHK Flat for rent in Jagatpur, Ahmedabad",Global Indian International School In Ahmedabad - Best International CBSE School,is 1.1 km away,Jenshiv Hospital - Physician - Diabetologist in Gota,is 0.9 km away,"A spacious home designed for families aspiring for a modern lifestyle, this Apartment is available for affordable rent in Ahmedabad. It is a 1 BHK Apartment situated in Jagatpur at a coveted location with well-developed infrastructure. This Apartment is a good example of a well-planned residential property with all new-age conveniences available for the residents. The unit is fully furnished. The 1 BHK prop...",
Shiv Sadhna Skywalk Manglaam,"3 BHK Flat for rent in Chandkheda, Ahmedabad",Fully Furnished,2000 sq.ft,"3 BHK Flat for rent in Chandkheda, Ahmedabad",Puna International School,is 3.8 km away,BHIMANI Children's Hospital & Vaccination Centre,is 3.1 km away,"Skywalk Mangalam it's totally new apartment near by zundal circle it's bigg apartment specious flat near by market near by mall near by hospital near by bus stand  More About This Property Check out this Apartment available for rent in Chandkheda in Ahmedabad. It is a 3 BHK unit that comes at an affordable rent, with modern features and premium amenities to suit your lifestyle needs. The unit is Fully Furni...",Property Highlights24 Hours ConciergeAerobics RoomAmphitheatreAnti Skid Titles
Aaryan Euphoria,"3 BHK Flat for rent in Chanakyapuri, Ahmedabad",Semi Furnished,1900 sq.ft,"3 BHK Flat for rent in Chanakyapuri, Ahmedabad","Sumati Vidhya Vihar, Ghatlodiya,",is 0.4 km away,Shayona Hospital & ICU,is 1.1 km away,"This Apartment can be a comfortable and affordable home for your family. It is a 3 BHK unit available on rent at Chanakyapuri in Ahmedabad. This Apartment comes with a plethora of amenities to meet your modern lifestyle needs. It is Semi Furnished. It is located on floor 3 of the building having a total 10 floors. Offering beautiful city views, this 3 BHK has been thoughtfully developed. It includes a total...",Property HighlightsChildren Play AreaCommunity HallFire Fighting SystemsGated Community
Sun Shela One,"2 BHK Flat for rent in Shela, Ahmedabad",Semi Furnished,1050 sq.ft,"2 BHK Flat for rent in Shela, Ahmedabad",Shanti Asiatic School,is 1.8 km away,Aalpa's children's hospital,is 3.4 km away,"Well maintained , connected to the schools and market  More About This Property This is a modern and stylish home available for affordable rent in Ahmedabad. It is a 2 BHK Apartment situated at Shela. Designed to meet your lifestyle needs, the Apartment provides a range of modern amenities for the comfort of the residents. It is semi furnished. Modern home seekers will experience a comfortable living in thi...",Property HighlightsLibraryLiftLandscaped Garden24x7 Security
Gala Celestia,"1 BHK Flat for rent in Vaishno Devi Circle, Ahmedabad",Semi Furnished,750 sq.ft,"1 BHK Flat for rent in Vaishno Devi Circle, Ahmedabad",SGVP International School,is 3.8 km away,KD Hospital,is 1.1 km away,"1.5bhk flat for rent prime location Vaishnodevi circle semi furnished flat family allow  More About This Property A spacious home designed for families aspiring for a modern lifestyle, this Apartment is available for affordable rent in Ahmedabad. It is a 1 BHK Apartment situated in Khodiyar at a coveted location with well-developed infrastructure. This Apartment is a good example of a well-planned residenti...",Property Highlights24x7 SecurityChildren Play AreaGated CommunityGymnasium
,"4 BHK Villa for rent in Ghuma, Ahmedabad",Fully Furnished,3150 sq.ft,"4 BHK Villa for rent in Ghuma, Ahmedabad",LDR International School - Ghuma Branch,is 1.2 km away,Krishna Shalby Multi-Specialty Hospital,is 1.2 km away,"4BHK VILLA FOR RENT , FULLY FURNISHED READY TO MOVE More About This Property A spacious home designed for families aspiring for a modern lifestyle, this Villa is available for affordable rent in Ahmedabad. It is a 4 BHK Villa situated in Ghuma at a coveted location with well-developed infrastructure. This Villa is a good example of a well-planned residential property with all new-age conveniences available ...",Property Highlights24x7 SecurityLandscaped GardenGated CommunityChildren Play Area
Saanvi Sky Sol,"2 BHK Flat for rent in Bopal, Ahmedabad",Semi Furnished,1150 sq.ft,"2 BHK Flat for rent in Bopal, Ahmedabad",LDR International School - South Bopal Branch,is 0.1 km away,Sannidhya Multi Speciality Hospital-Gynecologist|Sexologist|Piles|Hernia|Urology Doctor| Orthopedic in South Bopal,is 0.9 km away,"Peaceful Living with good society, with High security system...  More About This Property Check out this Apartment available for rent in Bopal in Ahmedabad. It is a 2 BHK unit that comes at an affordable rent, with modern features and premium amenities to suit your lifestyle needs. The unit is Semi Furnished. With numerous new-age amenities and green surroundings, this Apartment provides a convenient lifest...",Property Highlights24x7 SecurityChildren Play AreaClose to MallGymnasium
"Saral Parivesh, Chandkheda","2 BHK Flat for rent in Mankol, Ahmedabad",Fully Furnished,1200 sq.ft,"2 BHK Flat for rent in Mankol, Ahmedabad",St Joseph Higher Secondary School Complex,is 1 km away,Balmukund Children Hospital- New Ranip,is 3.4 km away,"Check out this Apartment available for rent in Mankol in Ahmedabad. It is a 2 BHK unit that comes at an affordable rent, with modern features and premium amenities to suit your lifestyle needs. The unit is fully furnished. It is an East facing property that has been constructed as per Vastu principles. With numerous new-age amenities and green surroundings, this Apartment provides a convenient lifestyle for...",Property Highlights24x7 SecurityATMChildren Play AreaClose to Airport
Goyal Arcus,"4 BHK Villa for rent in Shela, Ahmedabad",Fully Furnished,3740 sq.ft,"4 BHK Villa for rent in Shela, Ahmedabad",Shanti Asiatic School,is 0.1 km away,Suryam Children Hospital South Bopal,is 0.1 km away,"Villas in Sky City Arcus are crafted with utmost perfection, offering plenty of advantages, amenities and facilities, these living spaces are spread across 422 sq. yards along with private lawn which creates a positive, prosperous aura for the residents.
 
The project is designed with up to date civil work, modern technologies and best of amenities which is an added advantage. These villas are designed to h...",Property Highlights24 Hours ConciergeGymnasiumSecurity GuardsCommunity Hall
Pacifica Reflections,"4 BHK Flat for rent in Vaishno Devi Circle, Ahmedabad",Fully Furnished,3186 sq.ft,"4 BHK Flat for rent in Vaishno Devi Circle, Ahmedabad",Nirma Vidyavihar - Chharodi,is 1.6 km away,Ashirvad Hospital - Best Gynecologist | Orthopaedic | Psychiatrist | Neurologist | Pediatrician Doctor Hospital,is 1.9 km away,"Here is an excellent 4 BHK Independent Floor available for rent in Ahmedabad. Surrounded by natural greens and equipped with numerous amenities, this rented 4 BHK house offers a comfortable lifestyle for families. It is a spacious property nestled in Khodiyar that enjoys good connectivity to major landmarks of the city. The Independent Floor is on the 14 floor. There is a total of 14 floors. The Independent...",Property Highlights24x7 SecurityGated CommunityInternal RoadsLandscaped Garden
,"4 BHK Flat for rent in Vastrapur, Ahmedabad",Fully Furnished,2790 sq.ft,"4 BHK Flat for rent in Vastrapur, Ahmedabad",Nirman High School,is 0.7 km away,Hitarth Children Hospital,is 0.7 km away,"This is a modern and stylish home available for affordable rent in Ahmedabad. It is a 4 BHK Apartment situated at Vastrapur. Designed to meet your lifestyle needs, the Apartment provides a range of modern amenities for the comfort of the residents. It is Fully Furnished. Modern home seekers will experience a comfortable living in this 4 BHK property. The Apartment is on 2 floor, and the total number of floo...",Property Highlights24x7 SecurityCeramic TilesClose to Grocery StoresGood Cross Ventilation
Adani The Meadows,"3 BHK Flat for rent in Shantigram, Ahmedabad",Unfurnished,2280 sq.ft,"3 BHK Flat for rent in Shantigram, Ahmedabad",Adani International School - Ahmedabad,is 1.6 km away,KD Hospital,is 3.9 km away,The Meadows is a beautiful residential complex that is designed to fit all your needs and requirements. This modern residential property is located in the midst of nature and is surrounded by lavish greenery to bestow the feel of urban living without hampering any of the facilities of modern age metropolitan city life. This grand property is so designed that it can fulfill all your basic needs in a convenie...,Property HighlightsSwimming PoolGymnasiumGood Cross Ventilation24x7 Security
,"4 BHK Flat for rent in Bodakdev, Ahmedabad",Unfurnished,3300 sq.ft,"4 BHK Flat for rent in Bodakdev, Ahmedabad",Nirma Vidyavihar,is 0.6 km away,Apollo CVHF Heart Institute,is 0.6 km away,"This beautifully located 4BHK Flat is available for Rent in Bodakdev, Ahmedabad. It has has 3300 Sq.ft. built up  area. The Flat is UnFurnished and equipped with the basic amenities and connected with all major places.  More About This Property Here is an excellent 4 BHK Apartment available for rent in Ahmedabad. Surrounded by natural greens and equipped with numerous amenities, this rented 4 BHK house offe...",Property HighlightsATM24x7 SecurityPower BackupCommunity Hall
Orchid Legacy,"3 BHK Flat for rent in Shela, Ahmedabad",Semi Furnished,2024 sq.ft,"3 BHK Flat for rent in Shela, Ahmedabad",Lakshaya International School,is 4.1 km away,Suryam Children Hospital South Bopal,is 3.3 km away,"Check out this Apartment available for rent in Shela in Ahmedabad. It is a 3 BHK unit that comes at an affordable rent, with modern features and premium amenities to suit your lifestyle needs. The unit is semi furnished. It is an North-East facing property that has been constructed as per Vastu principles. With numerous new-age amenities and green surroundings, this Apartment provides a convenient lifestyle...",Property Highlights24x7 SecurityCeramic TilesClose to ATMClose to Grocery Stores
Grand Riviera,"2 BHK Flat for rent in Paldi, Ahmedabad",Semi Furnished,1200 sq.ft,"2 BHK Flat for rent in Paldi, Ahmedabad",Amrit Jyoti High School,is 2.1 km away,Long Life Hospital,is 0.9 km away,"If you are looking for a modern house on rent in Ahmedabad, this Apartment in Paldi can be your perfect home. It is a 2 BHK Apartment designed to meet your space and lifestyle needs. The 2 BHK unit is semi furnished. This rented 2 BHK property is spacious and well-designed, with access to all the conveniences for any modern home seeker. It is located on floor 3 out of a total 7 floors . The Apartment has 2 ...",Property HighlightsClose to ATMClose to Grocery StoresClose to HospitalClose to Mall
Vivaan Elementos,"3 BHK Flat for rent in Zundal, Ahmedabad",Semi Furnished,1800 sq.ft,"3 BHK Flat for rent in Zundal, Ahmedabad",Puna International School,is 0.1 km away,Ashirvad Hospital - Best Gynecologist | Orthopaedic | Psychiatrist | Neurologist | Pediatrician Doctor Hospital,is 0.1 km away,"Your search for a spacious home at affordable rent in Ahmedabad ends here. This 3 BHK Apartment in Zundal is all that you have been looking for! Designed as East facing, the unit is compliant with Vastu principles. The 3 BHK property offers a serene environment with excellent views of the city. This Apartment is equipped with the latest lifestyle amenities and all the conveniences at the doorstep. It is sem...",Property Highlights24x7 SecurityBusiness CenterClose to Bus StopClose to Hospital
Pacifica Reflections,"2 BHK Flat for rent in Vaishno Devi Circle, Ahmedabad",Fully Furnished,1350 sq.ft,"2 BHK Flat for rent in Vaishno Devi Circle, Ahmedabad",Nirma Vidyavihar - Chharodi,is 1.6 km away,Ashirvad Hospital - Best Gynecologist | Orthopaedic | Psychiatrist | Neurologist | Pediatrician Doctor Hospital,is 1.9 km away,"2 Bhk Full furnished flat available for rent Pacifica Reflection More About This Property A spacious home designed for families aspiring for a modern lifestyle, this Apartment is available for affordable rent in Ahmedabad. It is a 2 BHK Apartment situated in Khodiyar at a coveted location with well-developed infrastructure. This Apartment is a good example of a well-planned residential property with all new...",Property Highlights24x7 SecurityBusiness CenterChildren Play AreaClose to Grocery Stores
Olive Greens,"3 BHK Flat for rent in Gota, Ahmedabad",Fully Furnished,1850 sq.ft,"3 BHK Flat for rent in Gota, Ahmedabad",SMT K N Patel International School,is 0.1 km away,PMG Orthoedic Hospital,is 1.1 km away,3 Bhk Full furnished flat available for rent Olive green SG Highway  More About This Property This Apartment can be a comfortable and affordable home for your family. It is a 3 BHK unit available on rent at Gota in Ahmedabad. This Apartment comes with a plethora of amenities to meet your modern lifestyle needs. It is fully furnished. It is located on floor 4 of the building having a total 14 floors. Offerin...,Property Highlights24x7 SecurityBusiness CenterChildren Play AreaClose to Bus Stop
Dwarkesh Radiance,"3 BHK Flat for rent in Motera, Ahmedabad",Fully Furnished,1850 sq.ft,"3 BHK Flat for rent in Motera, Ahmedabad",IDP School,is 0.5 km away,"SBM, SATYABHAMADEVI BULCHAND MEMORIAL HOSPITAL",is 0.5 km away,"3 Bhk Luxurious Full Furnished Flat Available For Rent family. Working Bachelor. Company Guest house  More About This Property This is a modern and stylish home available for affordable rent in Ahmedabad. It is a 3 BHK Apartment situated at Motera. Designed to meet your lifestyle needs, the Apartment provides a range of modern amenities for the comfort of the residents. It is fully furnished. Modern home se...",Property Highlights24x7 SecurityBusiness CenterChildren Play AreaClose to Airport
Adani The Meadows,"3 BHK Flat for rent in Shantigram, Ahmedabad",Fully Furnished,1850 sq.ft,"3 BHK Flat for rent in Shantigram, Ahmedabad",Adani International School - Ahmedabad,is 1.6 km away,KD Hospital,is 3.9 km away,"Are you looking for an affordable Apartment for rent in Ahmedabad?. Here is a spacious 3 BHK Apartment in Khodiyar, promising a comfortable lifestyle. The Apartment is fully furnished. Built on floor 16 out of a total 17 floors, it is an ideal home providing beautiful views of the city’s skyline. This property is designed to suit your space needs and has 3 bedrooms and 1 bathroom. It also includes 1 balcony...",Property Highlights24x7 SecurityChildren Play AreaClose to HospitalCricket Pitch
Shripad Residency,"3 BHK Flat for rent in Gota, Ahmedabad",Fully Furnished,1800 sq.ft,"3 BHK Flat for rent in Gota, Ahmedabad",SMT K N Patel International School,is 1 km away,Mansi Women's Hospital - Best Gynec Hospital - Best Gynecologist in Gota,is 1 km away,"Sripad residency it's good apartment in gota near by hospital near by market near by bus stand near by school  More About This Property Here is an excellent 3 BHK Apartment available for rent in Ahmedabad. Surrounded by natural greens and equipped with numerous amenities, this rented 3 BHK house offers a comfortable lifestyle for families. It is a spacious property nestled in Gota that enjoys good connectiv...",Property HighlightsATMAnti Skid TitlesAmphitheatreAerobics Room
Seventh Grace,"3 BHK Flat for rent in Gota, Ahmedabad",Semi Furnished,1800 sq.ft,"3 BHK Flat for rent in Gota, Ahmedabad",SMT K N Patel International School,is 0.1 km away,Divine Women's Hospital,is 0.3 km away,"Seventh gress apartment it's new apartment near by market near by hospital near by bus stand near by school and furnishd flat  More About This Property A spacious home designed for families aspiring for a modern lifestyle, this Apartment is available for affordable rent in Ahmedabad. It is a 3 BHK Apartment situated in Gota at a coveted location with well-developed infrastructure. This Apartment is a good e...",Property HighlightsATMAnti Skid TitlesAmphitheatreAerobics Room
Shatrunjay Apartment,"3 BHK Flat for rent in Ramdev Nagar, Ahmedabad",Fully Furnished,1700 sq.ft,"3 BHK Flat for rent in Ramdev Nagar, Ahmedabad",Anand Niketan Group of Schools,is 0.5 km away,Shalby Multi-Specialty Hospitals,is 0.9 km away,"Your search for a spacious home at affordable rent in Ahmedabad ends here. This 3 BHK Apartment in Ramdevnagar is all that you have been looking for! Designed as East facing, the unit is compliant with Vastu principles. The 3 BHK property offers a serene environment with excellent views of the city. This Apartment is equipped with the latest lifestyle amenities and all the conveniences at the doorstep. It i...",Property HighlightsChildren Play AreaIndoor Game RoomSwimming PoolGymnasium
Shri Parshva Spg Evans,"2 BHK Flat for rent in Bopal, Ahmedabad",Fully Furnished,1250 sq.ft,"2 BHK Flat for rent in Bopal, Ahmedabad",LDR International School - South Bopal Branch,is 1 km away,Sannidhya Multi Speciality Hospital-Gynecologist|Sexologist|Piles|Hernia|Urology Doctor| Orthopedic in South Bopal,is 1.5 km away,"Luxurious Fully Furnished Flat for Rent in South Bopal  More About This Property Are you looking for an affordable Apartment for rent in Ahmedabad?. Here is a spacious 2 BHK Apartment in Bopal, promising a comfortable lifestyle. The Apartment is fully furnished. Built on floor 11 out of a total 14 floors, it is an ideal home providing beautiful views of the city’s skyline. This property is designed to suit ...",Property HighlightsGymnasiumChildren Play AreaIndoor Game RoomSwimming Pool
,"4 BHK Independent House for rent in Thaltej, Ahmedabad",Fully Furnished,4200 sq.ft,"4 BHK Independent House for rent in Thaltej, Ahmedabad",Zebar School for Children,is 1.3 km away,Global Longlife Hospital & Research Limited,is 2.9 km away,This is a well-designed 4 BHK Independent House available for rent. It is situated in a prime location of Ahmedabad at Thaltej. This modern Independent House is fully furnished. The 4 BHK unit fulfills all the needs of a modern lifestyle for families. The Independent House provides complete comfort for the residents. The Independent House lets you enjoy the lush greenery around. Meticulously designed to mee...,Property Highlights24x7 SecurityCricket PitchIndoor Game RoomGymnasium
Gala Eternia,"3 BHK Flat for rent in Thaltej, Ahmedabad",Fully Furnished,1750 sq.ft,"3 BHK Flat for rent in Thaltej, Ahmedabad",SKUM School,is 1.6 km away,Raghudeep Eye Hospital,is 1.1 km away,"Luxurious Fully Furnished Flat for Rent in Gala Eternia  More About This Property Your search for a spacious home at affordable rent in Ahmedabad ends here. This 3 BHK Apartment in Thaltej is all that you have been looking for! Designed as East facing, the unit is compliant with Vastu principles. The 3 BHK property offers a serene environment with excellent views of the city. This Apartment is equipped with...",Property HighlightsGymnasiumIndoor Game Room
Shivalik Platinum,"3 BHK Flat for rent in Satellite, Ahmedabad",Semi Furnished,1820 sq.ft,"3 BHK Flat for rent in Satellite, Ahmedabad",Prakash School,is 1.8 km away,Gautam Medicare Polyclinic Bodakdev,is 0.7 km away,"Newly Constructed Semifurnished flat for Rent in Bodakdev  More About This Property Check out this Apartment available for rent in Bodakdev in Ahmedabad. It is a 3 BHK unit that comes at an affordable rent, with modern features and premium amenities to suit your lifestyle needs. The unit is semi furnished. It is an East facing property that has been constructed as per Vastu principles. With numerous new-age...",Property HighlightsGymnasiumChildren Play AreaIndoor Game RoomSwimming Pool
Om Sky,"3 BHK Flat for rent in Science City, Ahmedabad",Fully Furnished,1815 sq.ft,"3 BHK Flat for rent in Science City, Ahmedabad",Taksh Education,is 0.9 km away,Balaji Horizon Women's Hospital,is 0.3 km away,"Luxurious Fully Furnished Flat for Rent in Science City  More About This Property Are you looking for an affordable Apartment for rent in Ahmedabad?. Here is a spacious 3 BHK Apartment in Sola Village, promising a comfortable lifestyle. The Apartment is fully furnished. Built on floor 7 out of a total 14 floors, it is an ideal home providing beautiful views of the city’s skyline. This property is designed t...",Property HighlightsGymnasiumChildren Play AreaIndoor Game RoomSwimming Pool
Royal Orchid,"3 BHK Flat for rent in Prahlad Nagar, Ahmedabad",Fully Furnished,1885 sq.ft,"3 BHK Flat for rent in Prahlad Nagar, Ahmedabad",Kameshwar vidhyamandir school,is 2 km away,Silver Touch Hospitals,is 1.3 km away,"Luxurious Fully Furnished Flat for Rent in Prahladnagar  More About This Property Here is an excellent 3 BHK Apartment available for rent in Ahmedabad. Surrounded by natural greens and equipped with numerous amenities, this rented 3 BHK house offers a comfortable lifestyle for families. It is a spacious property nestled in Prahlad Nagar that enjoys good connectivity to major landmarks of the city. The Apart...",Property HighlightsGymnasiumIndoor Game RoomChildren Play Area24x7 Security
Sun Southrayz,"2 BHK Flat for rent in South Bopal, Ahmedabad",Fully Furnished,1250 sq.ft,"2 BHK Flat for rent in South Bopal, Ahmedabad",UTKARSH HIGH SCHOOL,is 0.1 km away,Elite Orthopedic and Women's Hospital,is 0.4 km away,"Luxurious Furnished Flat for Rent in Sun South Rayz  More About This Property Are you looking for an affordable Apartment for rent in Ahmedabad?. Here is a spacious 2 BHK Apartment in South Bopal, promising a comfortable lifestyle. The Apartment is fully furnished. Built on floor 8 out of a total 14 floors, it is an ideal home providing beautiful views of the city’s skyline. This property is designed to sui...",Property HighlightsGymnasiumIndoor Game RoomSwimming PoolChildren Play Area
