SocietyName,BHK,Furnishing,BuiltUpArea,Locality,NearbyPlace_1,DistanceAway_1,NearbyPlace_2,DistanceAway_2,Description,Highlights
,"3 BHK Flat for rent in Vaishno Devi Circle, Ahmedabad",Semi Furnished,2100 sq.ft,"3 BHK Flat for rent in Vaishno Devi Circle, Ahmedabad",Gems Genesis International School (GGIS),is 3.1 km away,Ashirvad Hospital - Best Gynecologist | Orthopaedic | Psychiatrist | Neurologist | Pediatrician Doctor Hospital,is 1.1 km away,"3.5 bhk semi furnished flat in new scheme with premium lake facing from balcony with all amenities and easy connectivity from sg highway and sp ring road both. More About This Property Here is an excellent 3 BHK Apartment available for rent in Ahmedabad. Surrounded by natural greens and equipped with numerous amenities, this rented 3 BHK house offers a comfortable lifestyle for families. It is a spacious pr...",Property Highlights24x7 SecurityLiftCricket PitchGated Community
Adani The North Park,"4 BHK Villa for rent in Shantigram, Ahmedabad",Fully Furnished,4797 sq.ft,"4 BHK Villa for rent in Shantigram, Ahmedabad",Adani International School - Ahmedabad,is 0.6 km away,KD Hospital,is 7.7 km away,"It is finally here, the home you have always desired. Everyone has a picture of how their dream home should be and Sanidhya Harmony is that dream home meant for living a luxurious life loaded with world class amenities and features. Whether you are an investor looking for good returns or looking for moving in permanently, these aesthetically carved homes are your best bet. The architectural marvel is design...",Property HighlightsInternal RoadsGated Community24x7 SecurityLandscaped Garden
,"3 BHK Flat for rent in Jagatpur, Ahmedabad",Fully Furnished,1682 sq.ft,"3 BHK Flat for rent in Jagatpur, Ahmedabad",Global Indian International School In Ahmedabad - Best International CBSE School,is 1.1 km away,Jenshiv Hospital - Physician - Diabetologist in Gota,is 0.9 km away,Your search for a spacious home at affordable rent in Ahmedabad ends here. The 3 BHK property offers a serene environment with excellent views of the city. This Apartment is equipped with the latest lifestyle amenities and all the conveniences at the doorstep. It is fully furnished Apartment. This unit is built on floor 7 out of a total 12 floors. The Apartment has been thoughtfully designed to meet a famil...,Property Highlights24x7 SecuritySecurity GuardsLiftChildren Play Area
Anikedhya Atlantis,"3 BHK Flat for rent in Chandkheda, Ahmedabad",Fully Furnished,2000 sq.ft,"3 BHK Flat for rent in Chandkheda, Ahmedabad",MaidiGyandeep Higher Secondary School,is 0.8 km away,Divyadrashti Eye Hospital,is 1.9 km away,"This is a modern and stylish home available for affordable rent in Ahmedabad. It is a 3 BHK Apartment situated at Chandkheda. Designed to meet your lifestyle needs, the Apartment provides a range of modern amenities for the comfort of the residents. It is Fully Furnished. Modern home seekers will experience a comfortable living in this 3 BHK property. The Apartment is on 4 floor, and the total number of flo...",Property Highlights24x7 SecurityATMChildren Play AreaClose to Airport
Kailash Shivalay,"2 BHK Flat for rent in Kotarpur, Ahmedabad",Fully Furnished,1200 sq.ft,"2 BHK Flat for rent in Kotarpur, Ahmedabad",Ahmedabad Public School International,is 0.1 km away,Royal Gujarat General Hospital,is 2.1 km away,"Your search for a spacious home at affordable rent in Ahmedabad ends here. This 2 BHK Apartment in Kotarpur is all that you have been looking for! Designed as East facing, the unit is compliant with Vastu principles. The 2 BHK property offers a serene environment with excellent views of the city. This Apartment is equipped with the latest lifestyle amenities and all the conveniences at the doorstep. It is F...",Property Highlights24x7 SecurityATMChildren Play AreaClose to Airport
Pavanputra Pancham Pentagon,"2 BHK Flat for rent in Chandkheda, Ahmedabad",Fully Furnished,1300 sq.ft,"2 BHK Flat for rent in Chandkheda, Ahmedabad",Apollo International School Tragad,is 0.1 km away,Ashirvad Hospital - Best Gynecologist | Orthopaedic | Psychiatrist | Neurologist | Pediatrician Doctor Hospital,is 5.2 km away,"This Apartment can be a comfortable and affordable home for your family. It is a 2 BHK unit available on rent at Chandkheda in Ahmedabad. This Apartment comes with a plethora of amenities to meet your modern lifestyle needs. It is Fully Furnished. It is located on floor 4 of the building having a total 12 floors. Offering beautiful city views, this 2 BHK has been thoughtfully developed. It includes a total ...",Property Highlights24x7 SecurityATMChildren Play AreaClose to Airport
,"3 BHK Flat for rent in Vaishno Devi Circle, Ahmedabad",Semi Furnished,1850 sq.ft,"3 BHK Flat for rent in Vaishno Devi Circle, Ahmedabad",Gems Genesis International School (GGIS),is 3.1 km away,Ashirvad Hospital - Best Gynecologist | Orthopaedic | Psychiatrist | Neurologist | Pediatrician Doctor Hospital,is 1.1 km away,3.5 bhk spacious flat with balcony and great view from balcony and nice wind direction flat and totally lake facing in premium society with all amenities and new construction.  More About This Property This Apartment can be a comfortable and affordable home for your family. It is a 3 BHK unit available on rent at Khoraj in Ahmedabad. This Apartment comes with a plethora of amenities to meet your modern life...,Property Highlights24x7 SecurityChildren Play AreaBasketball CourtLift
,"3 BHK Flat for rent in Vaishno Devi Circle, Ahmedabad",Semi Furnished,1850 sq.ft,"3 BHK Flat for rent in Vaishno Devi Circle, Ahmedabad",Gems Genesis International School (GGIS),is 3.1 km away,Ashirvad Hospital - Best Gynecologist | Orthopaedic | Psychiatrist | Neurologist | Pediatrician Doctor Hospital,is 1.1 km away,"3 bhk huge spacious apartment with open great lake facing balcony  in new society with all amenities and good locality and easy connectivity to sg highway and sp ring road both. More About This Property A spacious home designed for families aspiring for a modern lifestyle, this Apartment is available for affordable rent in Ahmedabad. It is a 3 BHK Apartment situated in Khoraj at a coveted location with well...",Property Highlights24x7 SecurityBadminton CourtGated CommunitySkating Rink
,"3 BHK Flat for rent in Vaishno Devi Circle, Ahmedabad",Semi Furnished,1850 sq.ft,"3 BHK Flat for rent in Vaishno Devi Circle, Ahmedabad",Gems Genesis International School (GGIS),is 3.1 km away,Ashirvad Hospital - Best Gynecologist | Orthopaedic | Psychiatrist | Neurologist | Pediatrician Doctor Hospital,is 1.1 km away,"Are you looking for an affordable Apartment for rent in Ahmedabad?. Here is a spacious 3 BHK Apartment in Khoraj, promising a comfortable lifestyle. The Apartment is semi furnished. Built on floor 9 out of a total 12 floors, it is an ideal home providing beautiful views of the city’s skyline. This property is designed to suit your space needs and has 3 bedrooms and 3 bathroom. It also includes 2 balcony. Ne...",Property Highlights24x7 SecurityChildren Play AreaGated CommunitySecurity Guards
BR Poonam Pride,"4 BHK Independent House for rent in Shela, Ahmedabad",Fully Furnished,3000 sq.ft,"4 BHK Independent House for rent in Shela, Ahmedabad",Shanti Asiatic School,is 1.9 km away,Aalpa's children's hospital,is 3.5 km away,This is a well-designed 4 BHK Independent House available for rent. It is situated in a prime location of Ahmedabad at Shela. This modern Independent House is Fully Furnished. The 4 BHK unit fulfills all the needs of a modern lifestyle for families. The Independent House provides complete comfort for the residents. The Independent House lets you enjoy the lush greenery around. Meticulously designed to meet ...,Property HighlightsAnti Skid Titles24x7 SecurityAerobics RoomAmphitheatre
,"2 BHK Flat for rent in Satellite, Ahmedabad",Fully Furnished,1108 sq.ft,"2 BHK Flat for rent in Satellite, Ahmedabad",H B Kapadia New High School,is 1.4 km away,Vishwa Hospital,is 1.4 km away,"2bhk Satellite flat available for rent 24hours lift security water well maintained good locality More About This Property Check this beautiful 2 BHK Apartment available for rent in Ahmedabad. Nestled at a prime location in Satellite, it is an ideal home for those looking for a modern lifestyle. The Apartment is fully furnished, available for affordable rent. This 2 BHK unit is inside a gated society equippe...",Property Highlights24x7 SecurityATMChildren Play AreaClose to ATM
,"2 BHK Flat for rent in Science City, Ahmedabad",Semi Furnished,1160 sq.ft,"2 BHK Flat for rent in Science City, Ahmedabad",Taksh Education,is 0.1 km away,Vasundhara Children Hospital . Breastfeeding Clinic( Lactation Consultation)). Vaccination,is 1.3 km away,This is a well-designed 2 BHK Apartment available for rent. It is situated in a prime location of Ahmedabad at Thaltej. This modern Apartment is semi furnished. The 2 BHK unit fulfills all the needs of a modern lifestyle for families. There is a total of 10 floors. This unit is on 6 floor. The Apartment provides complete comfort for the residents. The Apartment lets you enjoy the lush greenery around. Metic...,Property HighlightsChildren Play AreaLiftSecurity Guards24x7 Security
,"3 BHK Flat for rent in Science City, Ahmedabad",Fully Furnished,1690 sq.ft,"3 BHK Flat for rent in Science City, Ahmedabad",Taksh Education,is 0.1 km away,Vasundhara Children Hospital . Breastfeeding Clinic( Lactation Consultation)). Vaccination,is 1.3 km away,"This Apartment can be a comfortable and affordable home for your family. It is a 3 BHK unit available on rent at Thaltej in Ahmedabad. This Apartment comes with a plethora of amenities to meet your modern lifestyle needs. It is Fully Furnished. It is located on floor 5 of the building having a total 7 floors. Offering beautiful city views, this 3 BHK has been thoughtfully developed. It includes a total of 3...",Property HighlightsLift24x7 SecuritySecurity GuardsChildren Play Area
Shivana Aurum,"3 BHK Flat for rent in South Bopal, Ahmedabad",Fully Furnished,1551 sq.ft,"3 BHK Flat for rent in South Bopal, Ahmedabad",LDR International School - South Bopal Branch,is 0.1 km away,Sannidhya Multi Speciality Hospital-Gynecologist|Sexologist|Piles|Hernia|Urology Doctor| Orthopedic in South Bopal,is 0.4 km away,"Check out this Apartment available for rent in South Bopal in Ahmedabad. It is a 3 BHK unit that comes at an affordable rent, with modern features and premium amenities to suit your lifestyle needs. The unit is fully furnished. It is an North facing property that has been constructed as per Vastu principles. With numerous new-age amenities and green surroundings, this Apartment provides a convenient lifesty...",Property Highlights24x7 SecurityAnti Skid TitlesChildren Play AreaClose to Grocery Stores
,"2 BHK Flat for rent in Satellite, Ahmedabad",Fully Furnished,1200 sq.ft,"2 BHK Flat for rent in Satellite, Ahmedabad",H B Kapadia New High School,is 0.8 km away,Sangini Hospital,is 0.6 km away,"3bhk Satellite flat available for rent 24hours lift security water well maintained good locality More About This Property Are you looking for an affordable Apartment for rent in Ahmedabad?. Here is a spacious 2 BHK Apartment in Satellite, promising a comfortable lifestyle. The Apartment is fully furnished. Built on floor 7 out of a total 12 floors, it is an ideal home providing beautiful views of the city’s...",Property Highlights24x7 SecurityATMClose to ATMClose to Mall
Gala Haven,"3 BHK Flat for rent in Vaishno Devi Circle, Ahmedabad",Fully Furnished,1848 sq.ft,"3 BHK Flat for rent in Vaishno Devi Circle, Ahmedabad",SGVP International School,is 3.1 km away,KD Hospital,is 0.3 km away,"If you are looking for a modern house on rent in Ahmedabad, this Apartment in Khodiyar can be your perfect home. It is a 3 BHK Apartment designed to meet your space and lifestyle needs. The 3 BHK unit is fully furnished. This rented 3 BHK property is spacious and well-designed, with access to all the conveniences for any modern home seeker. It is located on floor 6 out of a total 12 floors . The Apartment h...",Property Highlights24x7 SecurityATMChildren Play AreaClose to Airport
,"2 BHK Flat for rent in Science City, Ahmedabad",Fully Furnished,1207 sq.ft,"2 BHK Flat for rent in Science City, Ahmedabad",Taksh Education,is 0.1 km away,Vasundhara Children Hospital . Breastfeeding Clinic( Lactation Consultation)). Vaccination,is 1.3 km away,"A spacious home designed for families aspiring for a modern lifestyle, this Apartment is available for affordable rent in Ahmedabad. It is a 2 BHK Apartment situated in Thaltej at a coveted location with well-developed infrastructure. This Apartment is a good example of a well-planned residential property with all new-age conveniences available for the residents. The unit is Fully Furnished. The 2 BHK prope...",Property Highlights24 Hours Concierge24x7 SecuritySecurity GuardsLift
,"2 BHK Flat for rent in Shilaj, Ahmedabad",Fully Furnished,1241 sq.ft,"2 BHK Flat for rent in Shilaj, Ahmedabad",Anand Niketan Shilaj,is 2.5 km away,Atulit Children's Hospital,is 2.3 km away,"A spacious home designed for families aspiring for a modern lifestyle, this Apartment is available for affordable rent in Ahmedabad. It is a 2 BHK Apartment situated in Shilaj at a coveted location with well-developed infrastructure. This Apartment is a good example of a well-planned residential property with all new-age conveniences available for the residents. The unit is Fully Furnished. The 2 BHK proper...",Property Highlights24 Hours Concierge24x7 SecuritySecurity GuardsLift
,"2 BHK Flat for rent in Ghatlodiya, Ahmedabad",Fully Furnished,1231 sq.ft,"2 BHK Flat for rent in Ghatlodiya, Ahmedabad",Kottakkal Arya Vaidya Sala,is 1.1 km away,Viral multi super speciality hospital Ghatlodiya,is 0.4 km away,"If you are looking for a modern house on rent in Ahmedabad, this Apartment in Chanakyapuri can be your perfect home. It is a 2 BHK Apartment designed to meet your space and lifestyle needs. The 2 BHK unit is fully furnished. This rented 2 BHK property is spacious and well-designed, with access to all the conveniences for any modern home seeker. It is located on floor 4 out of a total 5 floors . The Apartmen...",Property HighlightsSecurity Guards24x7 SecurityLiftCommunity Hall
Nirman Rejoice,"2 BHK Flat for rent in Chandkheda, Ahmedabad",Fully Furnished,1500 sq.ft,"2 BHK Flat for rent in Chandkheda, Ahmedabad",SMT K N Patel International School,is 1.6 km away,Mansi Women's Hospital - Best Gynec Hospital - Best Gynecologist in Gota,is 1 km away,"This Apartment can be a comfortable and affordable home for your family. It is a 2 BHK unit available on rent at Chandlodia in Ahmedabad. This Apartment comes with a plethora of amenities to meet your modern lifestyle needs. It is fully furnished. It is located on floor 3 of the building having a total 10 floors. Offering beautiful city views, this 2 BHK has been thoughtfully developed. It includes a total ...",Property Highlights24x7 SecurityATMChildren Play AreaClose to Airport
Ganesh Malabar County,"3 BHK Flat for rent in Chharodi, Ahmedabad",Fully Furnished,1500 sq.ft,"3 BHK Flat for rent in Chharodi, Ahmedabad",Nirma Vidyavihar - Chharodi,is 0.4 km away,Jenshiv Hospital - Physician - Diabetologist in Gota,is 1.5 km away,"A spacious home designed for families aspiring for a modern lifestyle, this Apartment is available for affordable rent in Ahmedabad. It is a 3 BHK Apartment situated in Chharodi at a coveted location with well-developed infrastructure. This Apartment is a good example of a well-planned residential property with all new-age conveniences available for the residents. The unit is fully furnished. The 3 BHK prop...",Property Highlights24x7 SecurityATMChildren Play AreaClose to Airport
SS Sai Shraddha Residency,"3 BHK Flat for rent in Motera, Ahmedabad",Fully Furnished,1800 sq.ft,"3 BHK Flat for rent in Motera, Ahmedabad",Swastik Academy,is 0.2 km away,"SBM, SATYABHAMADEVI BULCHAND MEMORIAL HOSPITAL",is 0.6 km away,"Are you looking for an affordable Apartment for rent in Ahmedabad?. Here is a spacious 3 BHK Apartment in Motera, promising a comfortable lifestyle. The Apartment is Fully Furnished. Built on floor 3 out of a total 5 floors, it is an ideal home providing beautiful views of the city’s skyline. This property is designed to suit your space needs and has 3 bedrooms and 3 bathroom. It also includes 2 balcony. Th...",Property Highlights24x7 SecurityATMChildren Play AreaClose to Airport
Sangath Silver,"3 BHK Flat for rent in Motera, Ahmedabad",Fully Furnished,1800 sq.ft,"3 BHK Flat for rent in Motera, Ahmedabad",Swastik Academy,is 0.1 km away,Divyadrashti Eye Hospital,is 0.4 km away,"If you are looking for a modern house on rent in Ahmedabad, this Apartment in Motera can be your perfect home. It is a 3 BHK Apartment designed to meet your space and lifestyle needs. The 3 BHK unit is Fully Furnished. This rented 3 BHK property is spacious and well-designed, with access to all the conveniences for any modern home seeker. It is located on floor 3 out of a total 5 floors . The Apartment has ...",Property Highlights24x7 SecurityAnti Skid TitlesATMChildren Play Area
,"2 BHK Flat for rent in Vaishno Devi Circle, Ahmedabad",Fully Furnished,1210 sq.ft,"2 BHK Flat for rent in Vaishno Devi Circle, Ahmedabad",Gems Genesis International School (GGIS),is 3.1 km away,Ashirvad Hospital - Best Gynecologist | Orthopaedic | Psychiatrist | Neurologist | Pediatrician Doctor Hospital,is 1.1 km away,"Check out this Apartment available for rent in Khoraj in Ahmedabad. It is a 2 BHK unit that comes at an affordable rent, with modern features and premium amenities to suit your lifestyle needs. The unit is Fully Furnished. With numerous new-age amenities and green surroundings, this Apartment provides a convenient lifestyle for residents. A spacious house for your family, this unit includes 2 bedrooms. Ther...",Property Highlights24x7 SecuritySecurity GuardsChildren Play AreaLift
,"2 BHK Flat for rent in South Bopal, Ahmedabad",Fully Furnished,1193 sq.ft,"2 BHK Flat for rent in South Bopal, Ahmedabad",GYANJYOT PUBLIC SCHOOL,is 0.1 km away,Veeha Children's Hospital,is 0.9 km away,"Are you looking for an affordable Apartment for rent in Ahmedabad?. Here is a spacious 2 BHK Apartment in South Bopal, promising a comfortable lifestyle. The Apartment is fully furnished. Built on floor 7 out of a total 7 floors, it is an ideal home providing beautiful views of the city’s skyline. This property is designed to suit your space needs and has 2 bedrooms and 2 bathroom. It also includes 1 balcon...",Property Highlights24x7 SecuritySecurity GuardsChildren Play AreaLift
SKJ Siddharth Luxuria,"3 BHK Flat for rent in Jagatpur, Ahmedabad",Semi Furnished,1500 sq.ft,"3 BHK Flat for rent in Jagatpur, Ahmedabad",Global Indian International School In Ahmedabad - Best International CBSE School,is 1.4 km away,Jenshiv Hospital - Physician - Diabetologist in Gota,is 0.9 km away,"Check this beautiful 3 BHK Apartment available for rent in Ahmedabad. Nestled at a prime location in Gota, it is an ideal home for those looking for a modern lifestyle. The Apartment is semi furnished, available for affordable rent. This 3 BHK unit is inside a gated society equipped with various amenities and ample greenery. The Apartment is thoughtfully designed to ensure a comfortable living. It includes ...",Property Highlights24x7 SecurityATMChildren Play AreaClose to Airport
,"2 BHK Flat for rent in Prahlad Nagar, Ahmedabad",Fully Furnished,1250 sq.ft,"2 BHK Flat for rent in Prahlad Nagar, Ahmedabad",Kameshwar vidhyamandir school,is 0.6 km away,Silver Touch Hospitals,is 0.2 km away,"This is a modern and stylish home available for affordable rent in Ahmedabad. It is a 2 BHK Apartment situated at Prahlad Nagar. Designed to meet your lifestyle needs, the Apartment provides a range of modern amenities for the comfort of the residents. It is Fully Furnished. Modern home seekers will experience a comfortable living in this 2 BHK property. The Apartment is on 4 floor, and the total number of ...",Property Highlights24x7 SecurityChildren Play AreaGated CommunitySecurity Guards
,"3 BHK Flat for rent in Gota, Ahmedabad",Fully Furnished,1850 sq.ft,"3 BHK Flat for rent in Gota, Ahmedabad",SMT K N Patel International School,is 0.1 km away,Mansi Women's Hospital - Best Gynec Hospital - Best Gynecologist in Gota,is 0.6 km away,This is a well-designed 3 BHK Apartment available for rent. It is situated in a prime location of Ahmedabad at Gota. This modern Apartment is fully furnished. The 3 BHK unit fulfills all the needs of a modern lifestyle for families. There is a total of 10 floors. This unit is on 3 floor. The Apartment provides complete comfort for the residents. The Apartment lets you enjoy the lush greenery around. Meticul...,Property HighlightsSecurity Guards24x7 SecurityChildren Play AreaGated Community
,"2 BHK Flat for rent in Satellite, Ahmedabad",Fully Furnished,1250 sq.ft,"2 BHK Flat for rent in Satellite, Ahmedabad",AIS School,is 2.6 km away,Arham Surgical Hospital - Best Piles Surgeon | Circumcision | Appendix | Laser Piles Surgery | Piles Doctor in Ahmedabad,is 0.8 km away,"A spacious home designed for families aspiring for a modern lifestyle, this Apartment is available for affordable rent in Ahmedabad. It is a 2 BHK Apartment situated in Satellite at a coveted location with well-developed infrastructure. This Apartment is a good example of a well-planned residential property with all new-age conveniences available for the residents. The unit is Fully Furnished. The 2 BHK pro...",Property HighlightsSecurity Guards24x7 SecurityChildren Play AreaGated Community
,"2 BHK Flat for rent in Makarba, Ahmedabad",Fully Furnished,1250 sq.ft,"2 BHK Flat for rent in Makarba, Ahmedabad",DAV International School,is 0.3 km away,Faith Hospital and ICU - ICU/ Multispeciality Hospital/ Laparoscopic Surgery/Orthopedic Hospital In Juhapura,is 2.1 km away,"A spacious home designed for families aspiring for a modern lifestyle, this Apartment is available for affordable rent in Ahmedabad. It is a 2 BHK Apartment situated in Makarba at a coveted location with well-developed infrastructure. This Apartment is a good example of a well-planned residential property with all new-age conveniences available for the residents. The unit is Fully Furnished. The 2 BHK prope...",Property Highlights24x7 SecurityChildren Play AreaGated CommunitySecurity Guards
,"2 BHK Flat for rent in Shela, Ahmedabad",Fully Furnished,1250 sq.ft,"2 BHK Flat for rent in Shela, Ahmedabad",Shanti Asiatic School,is 2.1 km away,Suryam Children Hospital South Bopal,is 1.4 km away,"Are you looking for an affordable Apartment for rent in Ahmedabad?. Here is a spacious 2 BHK Apartment in Shela, promising a comfortable lifestyle. The Apartment is fully furnished. Built on floor 5 out of a total 11 floors, it is an ideal home providing beautiful views of the city’s skyline. This property is designed to suit your space needs and has 2 bedrooms and 2 bathroom. It also includes 1 balcony. Ne...",Property Highlights24x7 SecurityChildren Play AreaGated CommunitySecurity Guards
Adani Water Lily,"4 BHK Flat for rent in Shantigram, Ahmedabad",Semi Furnished,3600 sq.ft,"4 BHK Flat for rent in Shantigram, Ahmedabad",Adani International School - Ahmedabad,is 1 km away,KD Hospital,is 4.9 km away,"This Apartment can be a comfortable and affordable home for your family. It is a 4 BHK unit available on rent at Shantigram in Ahmedabad. This Apartment comes with a plethora of amenities to meet your modern lifestyle needs. It is semi furnished. It is located on floor 6 of the building having a total 17 floors. Offering beautiful city views, this 4 BHK has been thoughtfully developed. It includes a total o...",Property Highlights24x7 SecurityATMChildren Play AreaClose to Airport
Godrej Garden City Pinecrest,"3 BHK Flat for rent in Chandkheda, Ahmedabad",Semi Furnished,1300 sq.ft,"3 BHK Flat for rent in Chandkheda, Ahmedabad",Global Indian International School In Ahmedabad - Best International CBSE School,is 0.6 km away,Jenshiv Hospital - Physician - Diabetologist in Gota,is 2.6 km away,"This is a modern and stylish home available for affordable rent in Ahmedabad. It is a 3 BHK Apartment situated at Chandkheda. Designed to meet your lifestyle needs, the Apartment provides a range of modern amenities for the comfort of the residents. It is Semi Furnished. Modern home seekers will experience a comfortable living in this 3 BHK property. The Apartment is on 1 floor, and the total number of floo...",Property Highlights24x7 SecurityATMChildren Play AreaClose to Airport
,"3 BHK Flat for rent in Chandkheda, Ahmedabad",Fully Furnished,1677 sq.ft,"3 BHK Flat for rent in Chandkheda, Ahmedabad",Gyandeep Vidyalaya,is 1.7 km away,BHIMANI Children's Hospital & Vaccination Centre,is 2 km away,"Are you looking for an affordable Apartment for rent in Ahmedabad?. Here is a spacious 3 BHK Apartment in Chandkheda, promising a comfortable lifestyle. The Apartment is Fully Furnished. Built on floor 2 out of a total 5 floors, it is an ideal home providing beautiful views of the city’s skyline. This property is designed to suit your space needs and has 3 bedrooms and 3 bathroom. It also includes 2 balcony...",Property HighlightsSecurity Guards24x7 SecurityChildren Play AreaLift
